Hex,Emoji,English Name,Extra keywords
1FAD3,🫓,flatbread,"နံပြား, ပလာတာ, ချပါတီ, ပူရီ, အာလူးပူရီ, နန်းပြား, နံပြား, ရိုတီ, မုန့်ပြားစပ်, နန်းတော်ရှေ့ပလာတာ"
1F968,🥨,pretzel,"ပရက်ဇယ်, မုန့်ကြွပ်, ပေါင်မုန့်လိမ်, အဆာပြေမုန့်, ဂျုံမုန့်လိမ်, မုန့်, စားသောက်ကုန်, အငန်မုန့်, ဂျာမနီမုန့်, မုန့်ခြောက်"
1F96F,🥯,bagel,"ဘေဂယ်မုန့်, ဂျုံမုန့်အဝိုင်း, အလယ်အပေါက်ပါသောမုန့်, မနက်စာမုန့်, အာဟာရမုန့်, ပေါင်မုန့်, အစားအစာ, မုန့်တိုက်, မုန့်ဖုတ်, ခရင်မ်ချိစ်ဆမ်းထားသောမုန့်"
1F95E,🥞,pancakes,"ဘိန်းမုန့်, မြန်မာ့ရိုးရာမုန့်, ဆန်မုန့်, အချိုပွဲ, သရေစာ, မုန့်လင်မယား, မုန့်ပြားသလက်, ဘိန်းမုန့်, လမ်းဘေးစာ, ရိုးရာမုန့်စုံ"
1F9C7,🧇,waffle,"ဝေဖါမုန့်, မုန့်ပန်းခွေ, အနောက်တိုင်းမုန့်, ချိုချဉ်အရသာ, ကိတ်မုန့်အကြွပ်, အကွက်ဖော်မုန့်, ပျားလပို့မုန့်, မုန့်အကွက်, နံနက်စာမုန့်, အချိုပွဲမုန့်"
1F9C0,🧀,cheese wedge,"ဒိန်ခဲ, ချိစ်, ဒိန်ခဲတုံး, အဝါရောင်ဒိန်ခဲ, အဆာပြေစာ, နို့ထွက်ပစ္စည်း, အစားအစာ, အဝါရောင်, ပီဇာ, အနောက်တိုင်းစာ"
1F356,🍖,meat on bone,"အရိုးပါသောအသား, အမဲရိုး, ဝက်ရိုး, အသားတုံး, အသားကင်, အရိုးနု, အမဲသား, ဝက်သား, ကြက်သား, ဆိတ်သား"
1F357,🍗,poultry leg,"ကြက်ပေါင်, ကြက်ပေါင်ကျော်, ကြက်သား, ဘဲပေါင်, အသားဟင်း, ကြက်တောင်ပံ, ကြက်ကြော်, အစားအစာ, ဟင်းလျာ, စားဖွယ်သောက်ဖွယ်"
1F969,🥩,cut of meat,"အမဲသား, ဝက်သား, ဆိတ်သား, အသားတုံး, အသားကင်, ကြက်သား, ဘဲသား, အမဲနှပ်, တိုးတိုးသား, အသားဟင်း"
1F953,🥓,bacon,"ဝက်သားသုံးထပ်သား, ဝက်သားခြောက်, ဝက်သားဖတ်, အသားကင်, ဝက်သားကြော်, ဝက်သားပြား, ဝက်သားလွှာ, ဝက်ပေါင်ခြောက်, နံနက်စာ, အသားလွှာကင်"
1F354,🍔,hamburger,"ဟမ်ဘာဂါ, အသားညှပ်ပေါင်မုန့်, အမြန်စာ, မုန့်ဟင်းခါးမဟုတ်တဲ့အစားအစာ, အရသာရှိတာ, အမြန်စားသောက်ကုန်, အနောက်တိုင်းစာ, အသားညှပ်ပေါင်မုန့်ဆိုင်, အဆာပြေစာ, စားကောင်းသောအစားအစာ"
1F35F,🍟,french fries,"အာလူးကြော်, အာလူးချောင်းကြော်, အာလူးမာလာ, အကြော်, မုန့်ပဲသရေစာ, အာလူးချောင်း, အာလူးချောင်းကြော်နည်း, အဆာပြေမုန့်, အာလူးကြော်အစပ်, အာလူးမုန့်ု"
1F355,🍕,pizza,"ပီဇာ, အီတလီအစားအစာ, ချိစ်, အဆာပြေမုန့်, စားသောက်ဆိုင်, ဟမ်ဘာဂါ, အမြန်စာ, မုန့်ဖုတ်ဖို, ခရမ်းချဉ်သီးဆော့စ်, ဂျုံမုန့်သွတ်တံစိုး"
1F32D,🌭,hot dog,"ဟော့ဒေါ့, ဆော့ဆေ့ဂျ်မုန့်, အသားညှပ်ပေါင်မုန့်, အမြန်စာ, သရေစာ, ဝက်အူချောင်းမုန့်, စားသောက်ကုန်, အမြန်ရနိုင်သောအစားအစာ, အမေရိကန်အစားအစာ, ပေါင်မုန့်အသားညှပ်"
1F96A,🥪,sandwich,"ဆန်းဒဝစ်, ပေါင်မုန့်ညှပ်, ပေါင်မုန့်ညှပ်မုန့်, အဆာသွတ်ပေါင်မုန့်, ပေါင်မုန့်နှစ်ချပ်ကြားညှပ်, ပေါင်မုန့်၊ အသားညှပ်ပေါင်မုန့်၊ ပေါင်မုန့်ကင်၊ အဆာသွတ်မုန့်၊ လမ်းသရဲမုန့်"
1F32E,🌮,taco,"တာကိုး, မက္ကဆီကန်အစားအစာ, အစာသွတ်မုန့်, ခေါက်မုန့်, အသားညှပ်မုန့်, အရသာရှိသော, အဆာပြေမုန့်, စားဖွယ်စုံ, မက္ကဆီကန်ဟင်းလျာ, အဆာသွတ်ခေါက်မုန့်"
1F32F,🌯,burrito,"ဘာရီတို, မက္ကဆီကန်အစားအစာ, နံပြားလိပ်, အသားလိပ်, အစာသွတ်မုန့်, မက္ကဆီကန်လိပ်, အမဲသားလိပ်, ကြက်သားလိပ်, အဆာသွတ်မုန့်လိပ်, အမြန်စာ"
1FAD4,🫔,tamale,"တာမာလေ, ပြောင်းဖူးမုန့်ထုပ်, အစားအစာ, မက္ကဆီကန်အစားအစာ, အစာသွတ်မုန့်ထုပ်, မက္ကဆီကိုအစားအစာ, ပြောင်းဖူးမုန့်, အစာသွတ်မုန့်, လက်ဆောင်, အရသာရှိသော"
1F959,🥙,stuffed flatbread,"အသားညှပ်ပေါင်မုန့်, ပလာတာ, နန်းပြား, အစာသွတ်မုန့်, ရှမ်းမုန့်လင်မယား, အိန္ဒိယပလာတာ, ရိုတီ, ဂျုံပြား, အလွှာမုန့်, ခေါက်မုန့်"
1F9C6,🧆,falafel,"ဗယာကြော်, ဘယာကြော်, ကုလားပဲခြမ်းကြော်, ပဲကြော်, အကြော်, ရန်ကုန်ဗယာကြော်, မန္တလေးဗယာကြော်, ကုလားပဲထောင်းကြော်, အာခီယံ, အဆာပြေအစာ"
1F95A,🥚,egg,"ဥ, ကြက်ဥ, ဘဲဥ, ဥခွံ, ဥဖောက်, ဥအနှစ်, ဥအကာ, ငှက်ဥ, ဘဲဥပြုတ်, ကြက်ဥကြော်"
1F373,🍳,cooking,"ချက်, ကြော်, ချက်ပြုတ်, ဆီပူထိုး, ဟင်းချက်, ကင်, ကျို, ဆီသတ်, ပေါင်း, ဖုတ်"
1F958,🥘,shallow pan of food,"ဟင်းအိုး, ဟင်းပွဲ, အစားအသောက်, ထမင်းဝိုင်း, ဟင်းချက်သည်, စပိန်ထမင်းကြော်, ပန်းကန်ပြားဟင်း, ပင်လယ်စာဟင်း, ဟင်းချက်အိုး, စားသောက်ဖွယ်ရာ"
1F372,🍲,pot of food,"ဟင်းအိုး, ဟင်းခွက်, တပွဲ, စားသောက်ဖွယ်ရာ, ဟင်းလျာ, အစားအစာ, ဟင်းသီးဟင်းရွက်, မုန့်ဟင်းခါး, အရသာ, ချက်ပြုတ်စရာ"
1FAD5,🫕,fondue,"ဖွန်ဒူး, ဒိန်ခဲပူပူ, အသားနှစ်, တို့စားစရာ, ဆွစ်ဇာလန်အစားအစာ, အိုးပူ၊ ဒိန်ခဲအိုး၊ ချောကလက်ဖွန်ဒူး၊ တို့စားစရာအိုး၊ ချက်ပြုတ်စားသောက်ခြင်း"
1F963,🥣,bowl with spoon,"ဇွန်းပါသော ပန်းကန်လုံး, ဟင်းရည်ပန်းကန်, ဆန်ပြုတ်, မနက်စာ, အာဟာရ, ထမင်းချက်, ထမင်းရည်, ဟင်းချို, ဇွန်း, ခက်ရင်း"
1F957,🥗,green salad,"ဟင်းသီးဟင်းရွက်သုပ်, လက်ဖက်သုပ်, အသုပ်, အာဟာရရှိသောအစားအစာ, ကျန်းမာရေးနှင့်ညီညွတ်သောစားစရာ, ပဲသီးသုပ်, ခရမ်းချဉ်သီးသုပ်, ဂျင်းသုပ်, လက်သုပ်, အမြည်းသုပ်"
1F37F,🍿,popcorn,"ပြောင်းဖူးပေါက်ပေါက်, ပွားတယ်, ရုပ်ရှင်ကြည့်ရင်းစားသည့်မုန့်, စကားများတယ်, ပေါက်ပေါက်ဆုပ်, ရုပ်ရှင်ရုံ, အဆာပြေမုန့်, ပြောင်းဖူးလှော်, ခဲတံခြစ်, အကြွပ်ကြော်"
1F9C8,🧈,butter,"ထောပတ်, ဆီဥ, အဆီအဆိမ့်, ချက်ပြုတ်, မုန့်ဖုတ်, နို့ထွက်ပစ္စည်း, အဆီ, ထောပတ်သီး, စားသောက်ကုန်, ပေါင်မုန့်သုတ်စရာ"
1F9C2,🧂,salt,"ဆား, အငန်, ဟင်းခတ်မှုန့်, ငပိ, ငရုတ်သီးဆားထောင်, ဆားငန်, ဟင်းခတ်အမွှေးအကြိုင်, အပေါ့အငန်, သိန္ဓောဆား, ကျောက်ဆား"
1F96B,🥫,canned food,"စည်သွတ်ဗူး, စည်သွတ်အစားအစာ, ဟင်းရည်ဗူး, အသင့်စားဗူး, အရေးပေါ်ရိက္ခာ, ဘူးခွံ, စည်သွတ်ဘူးခွံ, အစားအစာဘူး, အရန်ရိက္ခာ, ရိက္ခာဗူး"
1F371,🍱,bento box,"ဘင်တို, ထမင်းဘူး, ဂျပန်ထမင်းဘူး, ဟင်းဘူး, နေ့လယ်စာဘူး, ပန်းကန်ပြား, ဇွန်း, ခက်ရင်း, ထမင်းချိုင့်, စားသောက်ဖွယ်ရာ"
1F358,🍘,rice cracker,"ပဲကပ်ကြော်, ပဲကြော်, ဘေဂျို, အကြော်, မုန့်ပဲသရေစာ, ပဲစပ်ကြော်, ကုလားပဲခြမ်းကြော်, စားစရာ, မုန့်, အမြည်း snacks"
1F359,🍙,rice ball,"မုန့်လုံးရေပေါ်, သင်္ကြန်မုန့်, အတာမုန့်, ထန်းလျက်မုန့်လုံး, ကောက်ညှင်းမုန့်, မြန်မာမုန့်, ရောင်စုံမုန့်လုံးရေပေါ်, ကောက်ညှင်းဆန်, အချိုပွဲ, သရေစာ"
1F35A,🍚,cooked rice,"ထမင်း, ထမင်းဖြူ, ထမင်းချက်, ထမင်းပွဲ, စားသောက်ဖွယ်ရာ, ထမင်းကြော်, ကောက်ညှင်း, ပန်းထမင်း, ထမင်းပေါင်း, လက်ဖက်ထမင်း"
1F35B,🍛,curry rice,"ဟင်း, ဟင်းလျာ, ထမင်းဟင်း, ဆီပြန်ဟင်း, နှပ်ဟင်း, ဟင်းချက်, ဆီပြန်, အမဲနှပ်, ကြက်သားဟင်း, ဝက်သားဟင်း"
1F35C,🍜,steaming bowl,"ခေါက်ဆွဲ, ခေါက်ဆွဲပြုတ်, အငွေ့တထောင်းထောင်းနှင့်ခေါက်ဆွဲပန်းကန်, စားဖွယ်, နေ့လယ်စာ, အုန်းနို့ခေါက်ဆွဲ, နန်းကြီးသုပ်, မုန့်ဟင်းခါး, ကြာဇံ, အစားအစာ"
1F35D,🍝,spaghetti,"အီတာလျံမုန့်တီ, စပါဂက်တီ, ခေါက်ဆွဲရှည်, အနောက်တိုင်းခေါက်ဆွဲ, ပတ်စတာ, ဥရောပခေါက်ဆွဲ, မုန့်တီဟင်း, အီတလီခေါက်ဆွဲ, ခေါက်ဆွဲပြုတ်, ဂျုံခေါက်ဆွဲရှည်"
1F360,🍠,roasted sweet potato,"ကန်စွန်းဥမီးဖုတ်, ကန်စွန်းဥ, မီးဖုတ်ထားသောကန်စွန်းဥ, အစာမကြေ, ရင်တစ်ဆို့, ဟင်းချက်နည်း, ကြက်သားဟင်း, အုန်းနို့, ဟင်းခတ်အမွှေးအကြိုင်, အာဟာရဖြစ်စေသော"
1F362,🍢,oden,"ဂျပန်စားသောက်ဖွယ်ရာ, အိုဒင့်, ငါးဆုတ်လုံးဟင်းချို, အစာသွတ်ငါးဆုတ်လုံး, စွပ်ပြုတ်, ဂျပန်အစားအစာ, အရည်သောက်ဟင်း, အသားလုံး, ဟင်းလျာ, အဆာပြေစာ"
1F363,🍣,sushi,"ဆူရှီ, ဂျပန်ထမင်းလိပ်, ငါးစိမ်းထမင်းလိပ်, နာရဲဇူရှီ, အစားအသောက်, ဟင်းလျာ, ပင်လယ်စာ, ထမင်းသုပ်, ငါးအစိမ်း, ဂျပန်အစားအစာ"
1F364,🍤,fried shrimp,"ပုစွန်ဆီပြန်, ပုစွန်ခြောက်ကြော်, ဘာလာချောင်, ပုစွန်ဆီဝေ့, ငပိကြော်, ပုစွန်ခြောက်သုပ်, ပုစွန်ကြော်, ပုစွန်ချက်, ပုစွန်သုပ်, ပုစွန်ချဉ်စပ်"
1F365,🍥,fish cake with swirl,"ငါးဖယ်ပြား, ငါးဖယ်လိပ်, နာရူတို, ရာမင်အစာပလာ, ရေဝဲပန်း, ဂျပန်ငါးမုန့်, ကာမာဘိုကို, ရာမင်အဆာ, ပန်းရောင်ရစ်ခွေ, ဆူရီမီ"
1F96E,🥮,moon cake,"လမုန့်, အလယ်အပတ်ပွဲတော်မုန့်, တရုတ်ရိုးရာမုန့်, လပြည့်ညမုန့်, အဆာသွတ်မုန့်, တရုတ်မုန့်, အစားအစာ, အချိုပွဲ, ပွဲတော်မုန့်, လပြည့်နေ့မုန့်"
1F361,🍡,dango,"မုန့်လုံးစွပ်, ဂျပန်မုန့်, အချိုမုန့်, မုန့်လုံးရေပေါ်, တုတ်ထိုးမုန့်, ဂျပန်မုန့်လုံး၊ ဆန်မုန့်၊ အစာသွတ်မုန့်၊ ရေနွေးငွေ့ဆွမ်း၊ တုတ်ထိုးအချိုမုန့်"
1F95F,🥟,dumpling,"ဖက်ထုပ်, ပေါက်စီ, မုန့်ဖက်ထုပ်, အစာသွတ်မုန့်, ရှုမိုင်း, ဌာပနာထုပ်, အာလူးကတ်သလစ်ကျော်, မုန့်လုံးရေပေါ်, ကော်ပြန့်, စောက်စို့ညှပ်"
1F960,🥠,fortune cookie,"ကံစမ်းမုန့်, ဟောကိန်းပါသောမုန့်, ဖော်ကျွန်းကွတ်ကီး, ကံကောင်းစေသောမုန့်, တရုတ်စားသောက်ဆိုင်မုန့်, ပရောဖက်ပြုချက်, အနာဂတ်ဟောချက်, နိမိတ်, ခန့်မှန်းချက်, အနာဂတ္တိညွှန်ကြားချက်"
1F961,🥡,takeout box,"ပါဆယ်, ပါဆယ်ထုတ်, အစားအသောက်ပါဆယ်, ထမင်းဘူး, ဟင်းဘူး, ပါဆယ်ထုပ်, ပါဆယ်ဆွဲ, ပြန်သယ်သွားမယ်, အိမ်သယ်မယ်, ထုပ်ပေးပါ"
1F366,🍦,soft ice cream,"အိုက်စကရင်, ရေခဲမုန့်, ကတော့ရေခဲမုန့်, အအေးစာ, အချိုပွဲ, ရေခဲချောင်း, အအေးမုန့်, ကာရန်တိုင်, ကရင်ဆော်ဒါ, နို့ခဲ"
1F367,🍧,shaved ice,"ရေခဲမုန့်သုတ်, ရေခဲခြစ်, ရွှေရင်အေး, အချိုပွဲ, ရေခဲမုန့်, မြန်မာ့မုန့်, ကျောက်ကျော, သာကူ, ပေါင်မုန့်, အုန်းနို့သာကူ"
1F368,🍨,ice cream,"ရေခဲမုန့်, အချိုပွဲ, အအေးစာ, ဆန်းဒေး, ကတော့ရေခဲမုန့်, အေးခဲမုန့်, ချိုချဉ်, နို့ခဲမုန့်, ကလေးကြိုက်, နွေရာသီစာ"
1F369,🍩,doughnut,"ဒိုးနပ်, မုန့်လက်ကောက်, အချိုမုန့်, အီကြာကွေး, မုန့်ဝိုင်း, မုန့်လက်ကောက်ကြော်, ထန်းလျက်ရည်, ကောက်ညှင်းမုန့်, အဆာပြေမုန့်, ရိုးရာမုန့်"
1F36A,🍪,cookie,"ကွတ်ကီး, မုန့်ချို, ဘီစကစ်, သရေစာ, မုန့်, ချိုချဉ်, အချိုပွဲ, ကိတ်မုန့်, စားသောက်ဖွယ်, အဆာပြေမုန့်"
1F382,🎂,birthday cake,"မွေးနေ့ကိတ်, မွေးနေ့ပျော်ရွှင်ပါစေ, ပျော်ရွှင်စရာမွေးနေ့ဖြစ်ပါစေ, မွေးနေ့လက်ဆောင်, ကိတ်မုန့်, မွေးနေ့သီချင်း, မွေးနေ့ပါတီ, မွေးနေ့မင်္ဂလာပါ, ကျန်းမာချမ်းသာပါစေ, အိပ်မက်တွေအကုန်အကောင်အထည်ဖော်နိုင်ပါစေ"
1F370,🍰,shortcake,"ကိတ်မုန့်, ရှော့ကိတ်, အချိုပွဲ, မွေးနေ့ကိတ်, စားစရာ, မုန့်, စားသောက်ကုန်, အချို, ကိတ်, မုန့်ချိုဆိမ့်"
1F9C1,🧁,cupcake,"ကိတ်မုန့်, ကိတ်, ကပ်ကိတ်, အချိုပွဲ, မုန့်, မုန့်ချို, ခရင်မ်, မုန့်ဖုတ်, ပါတီ, အရသာရှိသော"
1F967,🥧,pie,"မုန့်, ပိုင်မုန့်, အချိုပွဲ, ကိတ်မုန့်, ပေါင်မုန့်, စားစရာ, အချို, သရေစာမုန့်"
1F36B,🍫,chocolate bar,"ချောကလက်, ချောကလက်တောင့်, အချိုမုန့်, စားစရာ, လက်ဆောင်, ချိုချဉ်, အချို, ကူကီး, မုန့်, အစာပြေ"
1F36C,🍬,candy,"ချိုချဉ်, သကြားလုံး, မုန့်ချို, ထန်းလျက်, အာတာပူစီ, မုန့်ကုလားမဲ, မုန့်လက်ဆောင်း, ငှက်ပျောပေါင်း, ဟာလဝါ, မုန့်မရွေး"
1F36D,🍭,lollipop,"ချိုချဉ်ပလုတ်တုတ်, လက်ကိုင်ပါသောချိုချဉ်, သကြားလုံး, အချိုမုန့်, စုပ်လုံး, ထန်းလျက်ခဲ, ချိုချဉ်ခဲ, စားဖွယ်, အချိုစာ, အဆာပြေမုန့်"
1F36E,🍮,custard,"ကပ်စတပ်, အချိုပွဲ, နို့မုန့်, စားစရာ, မုန့်, ဥဥကပ်စတပ်, အချိုပွဲအမျိုးအစား, ကြက်ဥနို့မုန့်, နို့ဥမုန့်, စားဖွယ်ရာ"
1F36F,🍯,honey pot,"ပျားရည်အိုး, ပျားရည်, အချို, ဆွဲဆောင်မှုရှိသောအရာ, ထောင်ချောက်, အုန်းနို့ခေါက်ဆွဲ, ကြက်သား, ဟင်းရည်, အုန်းနို့, နံနံပင်"
1F37C,🍼,baby bottle,"နို့ဗူး, ကလေးနို့ဗူး, နို့တိုက်, နို့စို့ကလေး, ကလေးပစ္စည်း, မွေးကင်းစကလေး, နို့စို့ပုလင်း, ကလေးအစာ, မိခင်နို့, အာဟာရကျွေးခြင်း"
1F95B,🥛,glass of milk,"နို့, နို့ခွက်, နို့စိမ်း, နို့ဆီ, လက်ဖက်ရည်, အဖြူရောင်, အာဟာရ, သောက်စရာ, ကလေး, နွားနို့စစ်စစ်"
2615,☕,hot beverage,"ကော်ဖီ, လက်ဖက်ရည်, သောက်စရာ, အပူ, ကော်ဖီသောက်စို့, သောက်တယ်, ရေနွေး, လဖက်ရည်, ကော်ဖီဆိုင်, အချိုရည်"
1FAD6,🫖,teapot,"ရေနွေးကရား, လက်ဖက်ရည်အိုး, ရေနွေးအိုး, လဘက်ရည်အိုး, ရေနွေးအိုးအသေး, ရေနွေးအိုးကရား, ရေနွေးကရားအိုး, လက်ဖက်ရည်ခက်အိုး, ရေနွေးနွေးအိုး, အိုးကရား"
1F375,🍵,teacup without handle,"လက်ဖက်ရည်ကြမ်း, ရေနွေးကြမ်း, လက်ဖက်ရည်ပန်းကန်, တရုတ်လက်ဖက်ရည်ပန်းကန်, အကိုင်မပါသောခွက်, လက်ဖက်ရည်ခွက်, ရေနွေးခွက်, တရုတ်လက်ဖက်ရည်ခွက်, အကြမ်းပန်းကန်, လက်ဖက်ရည်သောက်ခွက်"
1F376,🍶,sake,"ဆာကေး, ဂျပန်ဆန်အရက်, ဆန်ဝိုင်, အရက်ဖြူ, သောက်စရာ, ဂျပန်အရက်, ဆန်အရက်, ယမကာ, အဖျော်ယမကာ, သောက်သုံးဖွယ်ရာ"
1F37E,🍾,bottle with popping cork,"ရှန်ပိန်, စပတ်ကလင်ဝိုင်, ပုလင်းဖောက်, အောင်ပွဲခံ, ဂုဏ်ပြု, ပျော်ပွဲရွှင်ပွဲ, မင်္ဂလာဆောင်, မွေးနေ့, ပါတီ, အရက်သေစာသုံးဆောင်ခြင်း"
1F377,🍷,wine glass,"ဝိုင်ခွက်, စပျစ်ရည်ခွက်, အရက်ခွက်, သောက်စား, ဂုဏ်ရှိန်မြင့်မား, မြည်းစမ်း, ဧည့်ခံ, ပွဲတော်, ဖန်ခွက်, အေးမြစေသော"
1F378,🍸,cocktail glass,"ကော့တေး, ကော့တေးဖန်ခွက်, အရက်သောက်, ပါတီပွဲ, ပျော်ပွဲရွှင်ပွဲ, ဖျော်ရည်, ဝိုင်ဖန်ခွက်, အနားယူခြင်း, ဧည့်ခံပွဲ, ဘားတိုက်သောက်သည်"
1F379,🍹,tropical drink,"အပန်းဖြေဖျော်ရည်, အအေးမိန့်, အချိုရည်, မော့လက်ဆောင်း, ရွှေရင်အေး, ဖာလူဒါ, သံပရာဆိုဒါ, သစ်သီးဖျော်ရည်, ထန်းရည်, အုန်းရည်ဖျော်ရည်"
