Hex,Emoji,English Name,Extra keywords
1F5A8-FE0F,🖨️,printer,"ပရင်တာ, ပရင့်ထုတ်စက်, စာကူးစက်, မိတ္တူကူးစက်, ပရင့်ထုတ်, ပုံနှိပ်စက်, ပုံနှိပ်ခြင်း, စာစီစာရိုက်, အော့ဖ်ဆက်ပုံနှိပ်နည်း, ပရင့်ထုတ်စနစ်"
2328-FE0F,⌨️,keyboard,"ကွန်ပျူတာကီးဘုတ်, လက်နှိပ်ခုံ, စာရိုက်, ဇော်ဂျီ, ယူနီကုဒ်, ကွန်ပျူတာခလုတ်ခုံ, ရိုက်နှိပ်သည်, စာလုံးရိုက်ခြင်း, မြန်မာဖောင့်, ယူနီကုတ်ကီးဘုတ်"
1F5B1-FE0F,🖱️,computer mouse,"ကွန်ပျူတာကြွက်, မောက်စ်, ကွန်ပျူတာမောက်စ်, ကြွက်, လက်ကိုင်ကြွက်, ကလစ်နှိပ်ခြင်း, စကရောဆွဲခြင်း, ညွှန်တံ, ဟာ့ဒ်ဝဲ, ကွန်ပျူတာဆက်စပ်ပစ္စည်းများ"
1F5B2-FE0F,🖲️,trackball,"ထရက်ဘော, ကွန်ပျူတာခလုတ်, လက်ချောင်းဖြင့်လှိမ့်ရသောမောက်စ်, နေရာမရွေးအသုံးပြုနိုင်သောမောက်စ်, အထိုင်မောက်စ်, ညွှန်ပြသည့်ကိရိယာ, ကွန်ပျူတာအပိုပစ္စည်း, လက်ဖြင့်လှိမ့်ရသောဘောလုံး, ထိန်းချုပ်ခလုတ်, ကွန်ပျူတာအသုံးအဆောင်ုပြုပစ္စည်း"
1F4BD,💽,computer disk,"ကွန်ပျူတာဓာတ်ပြား, ဒစ်ခ်, ဒစ်ပြား, ခွေ, အချက်အလက်သိုလှောင်သည့်ပြား, ဒေတာသိုလှောင်ကိရိယာ, ကွန်ပျူတာအခွေ, အချက်အလက်ပြား, ဒစ်စ်ခွေ, သိမ်းဆည်းသည့်ပြား"
1F4BE,💾,floppy disk,"ဖလော့ပီဒစ်စ်, ကွန်ပျူတာဒစ်စ်, အချက်အလက်သိမ်းဆည်းမှု, ရှေးဟောင်းပစ္စည်း, ဒေတာသိမ်းဆည်းရန်, ကွန်ပျူတာပစ္စည်း, ဒစ်စ်ပြား, ဒေတာသိုလှောင်မှု, သိမ်းဆည်းရန်နေရာ, နည်းပညာဟောင်း"
1F4BF,💿,optical disk,"စီဒီ, အော်ပတစ်ကယ်ဒစ်, ဗွီစီဒီ, ဒီဗွီဒီ, အခွေ, ဒစ်ခွေ, ကွန်ပြူတာအခွေ, အချက်အလက်သိုလှောင်မှု, ဒစ်စ်ခွေ, လေဆာဒစ်ခွေ"
1F4C0,📀,dvd,"ဒီဗီဒီ, အခွေ, ရုပ်ရှင်ခွေ, ဗီဒီယိုခွေ, ဇာတ်လမ်းခွေ, စီဒီ, ဗီဒီယို, အခွေပြား, ဒစ်စ်ခွေ, ရုပ်ရှင်ပစ္စည်း"
1F9EE,🧮,abacus,"ပေသီး, ဂဏန်းတွက်စက်, သင်္ချာတွက်ချက်, ရှေးဟောင်းတွက်ချက်မှုနည်းလမ်း, အစေ့များဖြင့်တွက်, ရှေးဟောင်းကိရိယာ, လက်ဖြင့်တွက်ချက်ခြင်း, သစ်သားပေသီး, အရေအတွက်မှတ်သားခြင်း, ဗုဒ္ဓဟူးဂြိုဟ်တိုင်စာရင်းညှိခြင်း"
1F3A5,🎥,movie camera,"ရုပ်ရှင်ကင်မရာ, ဗီဒီယိုရိုက်ကူးရေး, ရုပ်ရှင်ထုတ်လုပ်ရေး, အနုပညာဖန်တီးမှု, ကင်မရာသမား, မှတ်တမ်းတင်ခြင်း, ဗီဒီယိုဖိုင်, ရုပ်ရှင်ရိုက်ကွင်း, ရုပ်ရှင်လောက, ဖျော်ဖြေရေး"
1F39E-FE0F,🎞️,film frames,"ရုပ်ရှင်, ဖလင်ပြား, ဗီဒီယို, ရုပ်ရှင်ရိုက်ကူး, ကင်မရာ, ရုပ်ရှင်ပြကွက်, ဖလင်လိပ်, မှတ်တမ်းတင်, ဗီဒီယိုရိုက်ကူးရေး, အနုပညာ ပြသခြင်း"
1F4FD-FE0F,📽️,film projector,"ရုပ်ရှင်ပြစက်, ပရိုဂျက်တာ, ဖလင်ကားပြစက်, ရုပ်ရှင်ရုံ, ဖလင်လိပ်, ဗီဒီယိုပြစက်, ရုပ်ရှင်ကား, ရုပ်ရှင်ဇာတ်ကား, ပိတ်ကား, ရုပ်ရှင်ကြည့်သည်"
1F3AC,🎬,clapper board,"ရုပ်ရှင်ရိုက်ကူးရေး, ကလက်ပါဘုတ်, ရုပ်ရှင်သင်္ကေတ, ရုပ်ရှင်ထုတ်လုပ်ရေး, မှတ်တမ်းတင်, ရုပ်ရှင်လောက, ဒါရိုက်တာ, သရုပ်ဆောင်, ရုပ်ရှင်ဇာတ်ကား, ဗီဒီယိုရိုက်ကူးရေး"
1F4FA,📺,television,"ရုပ်မြင်သံကြား, တီဗွီ, ရုပ်ရှင်, သတင်း, အစီအစဉ်, ချန်နယ်, ဇာတ်လမ်းတွဲ, ရုပ်သံ, ကြော်ငြာ, လိုင်းသစ်"
1F4F7,📷,camera,"ဓာတ်ပုံ, ကင်မရာ, ရိုက်ကူး, မှတ်တမ်းတင်, အမှတ်တရ, ဗီဒီယို, ရုပ်ပုံ, မှန်ဘီလူး, ဖလက်ရှ်, ရှုခင်း ရိုက်ကူးခြင်း"
1F4F8,📸,camera with flash,"ကင်မရာ, ဓာတ်ပုံရိုက်, မှတ်တမ်းတင်, ဖလက်ရှ်မီး, ဖုန်းကင်မရာ, ဓာတ်ပုံ, ဗီဒီယို, ရုပ်ပုံ, မှတ်တမ်း, အလင်းပြန်စနစ်"
1F4F9,📹,video camera,"ဗီဒီယိုကင်မရာ, ရုပ်ရှင်ရိုက်ကူး, မှတ်တမ်းတင်, ဗီဒီယိုရိုက်, ကင်မရာ, ဓာတ်ပုံရိုက်, မှတ်တမ်းတင်ခြင်း, ဒစ်ဂျစ်တယ်ကင်မရာ, ရုပ်သံ, ရိုက်ကူးရေး"
1F4FC,📼,videocassette,"ဗီဒီယိုကက်ဆက်, ကက်ဆက်ခွေ, ဗီဒီယိုခွေ, ရှေးဟောင်းဗီဒီယိုခွေ, မှတ်တမ်းတင်ခွေ, ဗီဒီယိုတိပ်, ကက်ဆက်တိပ်, ရုပ်ရှင်ခွေ, ဗီဒီယိုမှတ်တမ်း, ရှေးဟောင်းပစ္စည်း"
1F50D,🔍,magnifying glass tilted left,"မှန်ဘီလူး, ရှာဖွေ, စစ်ဆေး, အနီးကပ်ကြည့်, ချဲ့ကြည့်, စုံစမ်းစစ်ဆေးသူ, အလွတ်စုံထောက်, စူးစမ်းလေ့လာသော, စူးစမ်းရှာဖွေ, စုံစမ်းမေးမြန်းခြင်း"
1F50E,🔎,magnifying glass tilted right,"မှန်ဘီလူး, ရှာဖွေ, စစ်ဆေး, အနီးကပ်ကြည့်, စူးစမ်း, ကြည့်ရှုသည်, ရှာဖွေရေး, မှန်ဘီလူးဖြင့်ကြည့်သည်, အသေးစိတ်ကြည့်သည်, ဖော်ထုတ်သည်"
1F56F-FE0F,🕯️,candle,"ဖယောင်းတိုင်, မီးထွန်း, ဆုတောင်း, အောက်မေ့သတိရ, အလင်းရောင်, ငြိမ်းချမ်းရေး, ပျော်ရွှင်မှု, ကရုဏာ, ကြင်နာမှု, ကျေးဇူးတင်ခြင်း"
1F4A1,💡,light bulb,"မီးသီး, အကြံရည်ရွယ်ချက်, အလင်းရောင်, အကြံဉာဏ်, အိုင်ဒီယာ, တီထွင်မှု, ဉာဏ်အလင်း, လျှပ်စစ်မီးသီး, အလင်းပြခြင်း, စဉ်းစားမိခြင်း"
1F526,🔦,flashlight,"လက်နှိပ်ဓာတ်မီး, ဓာတ်မီး, အလင်းရောင်, မီးထိုးသည်, အမှောင်ထဲတွင်ကြည့်သည်, မီးအိမ်, ဘက်ထရီ, လျှပ်စစ်မီး, အလင်းပြစက်, မီးထွန်းသည်"
1F3EE,🏮,red paper lantern,"မီးပုံး, အနီရောင်မီးပုံး, တရုတ်မီးပုံး, မီးကြာ, မီးကြာလှည့်လည်ပွဲ, သီတင်းကျွတ်, မီးထွန်းပွဲတော်, ဖယောင်းတိုင်, ဆီမီး, လက်လုပ်မီးပုံး"
1FA94,🪔,diya lamp,"ဆီမီးခွက်, ဆီမီး, ဒီးယားမီးခွက်, ဒေဝါလီမီးထွန်းပွဲ, အလင်းတိုင်, သီတင်းကျွတ်, မီးထွန်းပွဲ, ဖယောင်းတိုင်, မီးအိမ်, အလင်းရောင်"
1F4D4,📔,notebook with decorative cover,"မှတ်စုစာအုပ်, ဒိုင်ယာရီ, မှတ်တမ်းစာအုပ်, လက်ရေးစာအုပ်, ရှမ်းစက္ကူမှတ်စုစာအုပ်, ပုရပိုက်, စာအုပ်, မှတ်စုစာအုပ်အဖုံးမာ, ခေါက်စာအုပ်, စာရေးကိရိယာ"
1F4D5,📕,closed book,"စာအုပ်, အနီရောင်စာအုပ်, ပညာရေး, ဗဟုသုတ, စာဖတ်, မှတ်တမ်း, စာကြည့်တိုက်, စာပေ, လေ့လာရေး, မှတ်စုမိတ္တူ"
1F4D6,📖,open book,"စာအုပ်, ဖွင့်ထားသောစာအုပ်, ဗဟုသုတ, ပညာရေး, စာဖတ်, စာပေ, သင်ကြားရေး, မှတ်စု, ကျောင်းစာ, ဗဟုသုတဘဏ်"
1F4D7,📗,green book,"အစိမ်းရောင်စာအုပ်, စီအိုင်စာအုပ်, အလုပ်သမားမှတ်ပုံတင်လက်မှတ်, ထိုင်းရောက်မြန်မာအလုပ်သမားကတ်, ယာယီမည်သူမည်ဝါဖြစ်ကြောင်းသက်သေခံလက်မှတ်, စီအိုင်ပတ်စပို့, စိမ်းရောင်စုံစာအုပ်, အလုပ်သမားကတ်, ပန်းရောင်ကတ်, မည်သူမည်ဝါဖြစ်ကြောင်းသက်သေခံလက်မှတ်"
1F4D8,📘,blue book,"အပြာရောင်စာအုပ်, အပြာစာအုပ်, လေ့လာရေး, မှတ်စုစာအုပ်, စာဖတ်, ပညာရေး, စာကြည့်တိုက်, ဝတ္ထု, ဗဟုသုတ, ကျောင်းစာအုပ်"
1F4D9,📙,orange book,"လိမ္မော်ရောင်စာအုပ်, မှတ်စုစာအုပ်, ပြဌာန်းစာအုပ်, လိမ္မော်ရောင်, စာပေ, စာအုပ်, ဗဟုသုတ, ပညာရေး, ဖတ်ရှုခြင်း, စာကြည့်တိုက်"
1F4DA,📚,books,"စာအုပ်, စာပေ, ပညာဗဟုသုတ, စာဖတ်, စာကျက်, စာကြည့်တိုက်, ဗဟုသုတ, သင်ခန်းစာ, ပညာရေး, ကျောင်းစာအုပ်"
1F4D3,📓,notebook,"မှတ်စုစာအုပ်, ရာဇဝင်ခွေ, မှတ်တမ်း, ဒိုင်ယာရီ, စာအုပ်, စာရေးစာအုပ်, မှတ်စု, ဒိုင်ယာရီစာအုပ်, အိတ်ဆောင်စာအုပ်, မှတ်တမ်းစာအုပ်"
1F4D2,📒,ledger,"စာရင်းအင်းစာအုပ်, မှတ်တမ်းစာအုပ်, လယ်ဂျာ, ငွေစာရင်းစာအုပ်, စာရင်းကိုင်, စာရင်းစာအုပ်, မှတ်တမ်းတင်ခြင်း, ဘဏ္ဍာရေးစာအုပ်, စာရင်းအင်း, နေ့စဉ်မှတ်တမ်းစာအုပ်"
1F4C3,📃,page with curl,"စာရွက်စာတမ်း, စာရွက်, မှတ်တမ်း, စာစု, လိပ်ထားသောစာရွက်, စာရင်း, စာသား, အစီရင်ခံစာ, မှတ်စု, က္ကူပြား"
1F4DC,📜,scroll,"ပုရပိုက်, ပေစာ, ကမ္မဝါ, ရှေးဟောင်းစာပေ, မှတ်တမ်း, စာမူ, ပေထုပ်, ကဗျာလင်္ကာ, ကျောက်စာ, ရှေးဟောင်းစာရင်းမြတ်"
1F4C4,📄,page facing up,"စာရွက်စာတမ်း, စာမျက်နှာ, အစီရင်ခံစာ, မှတ်တမ်း, ဖိုင်, စာရွက်, စာစု, လက်မှတ်, ဒေတာ, အချက်အလက်"
1F4F0,📰,newspaper,"သတင်းစာ, ဂျာနယ်, သတင်းမီဒီယာ, စာစောင်, ကြေးမုံ, ဂျာနယ်လစ်, သတင်းစာဆရာ, အယ်ဒီတာ, ပြန်ကြားရေး, သတင်းစာတိုက်"
1F5DE-FE0F,🗞️,rolled-up newspaper,"သတင်းစာ, လိပ်ထားသောသတင်းစာ, သတင်းစာလိပ်, ဂျာနယ်, စာစောင်, မီဒီယာ, သတင်းလွှာ, စာနယ်ဇင်း, အချက်အလက်, သတင်းအချက်အလက်"
1F4D1,📑,bookmark tabs,"စာညှပ်, စာညှပ်တဘ်များ, မှတ်သားချက်များ, စာမျက်နှာအမှတ်အသား, စာအုပ်မှတ်သားရန်, စာဖတ်အမှတ်အသား, စာအုပ်ညှပ်, မှတ်သားရန်, စာမျက်နှာအမှတ်အသားများ, စာညှပ်တံ"
1F516,🔖,bookmark,"စာညှပ်, မှတ်သားချက်, အမှတ်အသား, စာမျက်နှာမှတ်ရန်, အရေးကြီးသောအချက်အလက်မှတ်သား, စာအုပ်မှတ်ရုံ, စာမျက်နှာအမှတ်အသား, မှတ်သားတံ, စာမျက်နှာအညွှန်း, မှတ်သားရန်နေရာ"
1F3F7-FE0F,🏷️,label,"တံဆိပ်, အမှတ်အသား, လက်မှတ်, စျေးနှုန်းတံဆိပ်, ကပ်ခွာ, ကတ်ပြား, ဆိုင်းဘုတ်, တံဆိပ်ခေါင်း, အမှတ်တရ, မှတ်သားချက်"
1F4B0,💰,money bag,"ပိုက်ဆံအိတ်, ငွေထုတ်, အိတ်သွန်ဖက်လတ်, ကြွယ်ဝ, လာဘ်လာဘ, မြန်မာငွေ, ကျပ်ငွေ, ဘဏ္ဍာရေး, ငွေကြေး, စုဘူး"
1FA99,🪙,coin,"ဒင်္ဂါးပြား, အကြွေစေ့, ပိုက်ဆံ, အကြွေ, ကျပ်, ငွေပြား, အနုတ်ငွေ, ငွေကြေး, သိန်း, ငွေစက္ကူ"
1F4B4,💴,yen banknote,"ယန်းငွေ, ဂျပန်ပိုက်ဆံ, ယန်းငွေစက္ကူ, ပိုက်ဆံ, ငွေကြေး, ကျပ်, ငွေသား, အနုတ်ငွေ, ဈေးနှုန်း, ငွေလဲလှယ်နှုန်း"
1F4B5,💵,dollar banknote,"ပိုက်ဆံ, ငွေစက္ကူ, ငွေကြေး, ဒေါ်လာ, အနုတ်ငွေ, မြန်မာကျပ်ငွေ, ငွေကြေးလဲလှယ်ခြင်း, ဗဟိုဘဏ်, ငွေစက္ကူအထုပ်, ပိုက်ဆံအိတ်"
1F4B6,💶,euro banknote,"ယူရို, ယူရိုငွေစက္ကူ, ဥရောပငွေ, ပိုက်ဆံ, ငွေကြေး, ငွေ, ငွေကြေးစနစ်, ဥရောပငွေကြေး, နိုင်ငံခြားငွေ, ငွေလဲလှယ်နှုန်း"
1F4B7,💷,pound banknote,"ဗြိတိသျှပေါင်ငွေ, ပေါင်စတာလင်, ပေါင်စတာလင်ငွေစက္ကူ, ပေါင်ပိုက်ဆံ, အင်္ဂလိပ်ပိုက်ဆံ, မြန်မာငွေ, ပိုက်ဆံအိတ်, ငွေစက္ကူများ, ကျပ်ငွေအိတ်, နိုင်ငံခြားငွေလဲလှယ်နှုန်း"
1F4B8,💸,money with wings,"ပိုက်ဆံ, ငွေကြေး, အသုံးရမ်း, အကုန်အကျများ, ပိုက်ဆံကုန်, ကျပ်ငွေ, မြန်မာငွေ, ငွေအိတ်, စုဆောင်းခြင်း, ချမ်းသာကြွယ်ဝမှု"
1F4B3,💳,credit card,"အကြွေးဝယ်ကတ်ပြား, ခရက်ဒစ်ကတ်, ပလတ်စတစ်ပိုက်ဆံ, ဘဏ်ကတ်, အကြွေးဝယ်ကတ်, ဗီဇာကတ်, မာစတာကတ်, ငွေပေးချေကတ်, အီလက်ထရောနစ်ပိုက်ဆံ, ဘဏ်စာရင်းဝင်ကတ်"
1F9FE,🧾,receipt,"ဘောက်ချာ, ပြေစာ, ငွေရယူပြီးကြောင်းလက်မှတ်, ငွေရပြေစာ, အဝယ်စာရင်း, ဘောက်ချာဖြတ်ပိုင်း, ငွေပေးချေမှုမှတ်တမ်း, ကုန်ဝယ်ပြေစာ, ငွေရပြေစာအမှတ်, အဝယ်တော်မှတ်တမ်း"
1F4B9,💹,chart increasing with yen,"ဂျပန်ယန်းငွေဈေးတက်, စတော့ရှယ်ယာတက်, စီးပွားရေးတက်, အမြတ်အစွန်းရ, ငွေဈေးတက်, စီးပွားရေးဖွံ့ဖြိုးမှု, ရင်းနှီးမြှုပ်နှံမှု, နိုင်ငံခြားငွေလဲလှယ်နှုန်း, ဂျပန်ယန်, အောင်မြင်မှုစတော့ဇယား"
2709-FE0F,✉️,envelope,"စာပို့, အီးမေးလ်, စာအိတ်, သတင်းစကား, အကြောင်းကြားစာ, စာတိုက်, စာတိုက်ဖုံး, ပေးစာ, မှတ်တမ်း, ဆက်သွယ်မှု"
1F4E7,📧,e-mail,"အီးမေးလ်, အီးမေး, စာပို့သည်, အီလက်ထရောနစ်စာပို့စနစ်, သတင်းစကား, ခေါင်းစဉ်, ပူးတွဲစာ, ပြန်စာ, မေးမြန်းခြင်း, အကြောင်းကြားစာ"
1F4E8,📨,incoming envelope,"စာအိတ်, မေးလ်, အီးမေးလ်, စာပို့သည်, စာရောက်သည်, စာလွှာ, ပေးစာ, ဆက်သွယ်ရန်, သတင်းစကား, စာလက်ခံရရှိသည်"
1F4E9,📩,envelope with arrow,"စာပို့, အီးမေးလ်, အကြောင်းကြားစာ, သတင်းစကား, စာတို, စာပေးစာယူ, လက်ခံရရှိသည်, ဝင်စာ, အိတ်ဖွင့်စာ, အချက်အလက်ပို့ဆောင်ခြင်း"
1F4E4,📤,outbox tray,"စာပို့ဗူး, စာထည့်ခွက်, အဝင်စာ, အထွက်စာ, စာပေးစာယူ, စာရွက်စာတမ်း, ဖိုင်တွဲ, ရုံးသုံးပစ္စည်း, စာစီစာကုံး, မှတ်တမ်းဖိုင်"
1F4E5,📥,inbox tray,"စာတိုက်ပုံး, စာလက်ခံပုံး, အဝင်စာတွဲ, စာဖိုင်တွဲ, စာရွက်စာတမ်းဗန်း, စာတိုက်သေတ္တာ, စာလက်ခံသည့်ဗန်း, အီးမေးလ်, အဝင်စာ, လက်ခံရရှိစာများ"
1F4E6,📦,package,"ပါဆယ်, အထုပ်, ဘောက်စ်, ပစ္စည်းပါဆယ်, အော်ဒါ, အထုတ်အပိုး, ပါဆယ်ထုပ်, ပါဆယ်ပစ္စည်း, ပစ္စည်းထုပ်, ထုပ်ပိုးမှု"
1F4EB,📫,closed mailbox with raised flag,"စာတိုက်သေတ္တာ, စာပို့ပုံး, စာတိုက်ပုံး, စာပို့ရန်ရှိသည်, အလံထောင်ထားသောစာတိုက်ပုံး, စာပေးစာယူ, ပေးစာ, ပြန်စာ, အကြောင်းကြားစာ, သတင်းစကား"
1F4EA,📪,closed mailbox with lowered flag,"စာတိုက်ပုံး, စာပုံး, စာပို့ပုံး, စာအိတ်ပုံး, အပြာရောင်စာတိုက်ပုံး, စာတိုက်, အီးမေးလ်, သတင်းစကား, စာပို့စနစ်, အကြောင်းကြားစာ"
1F4EC,📬,open mailbox with raised flag,"စာတိုက်ပုံး, အလံထောင်ထားသောစာတိုက်ပုံး, စာပို့ပုံး, မေးလ်ပုံး, စာလက်ခံပုံး, အီးမေးလ်, စာမူတိုက်, စာပို့တိုက်, စာအိတ်, ဆက်သွယ်ရေး"
1F4ED,📭,open mailbox with lowered flag,"စာတိုက်ပုံး, စာအိတ်, စာပို့, စာမလာ, အီးမေးလ်မရှိ, စာတိုက်သေတ္တာ, စာပို့ပုံး, စာအိတ်အလွတ်, အကြောင်းကြားစာ, ဆက်သွယ်ရန်"
1F4EE,📮,postbox,"စာတိုက်သေတ္တာ, စာပို့တိုက်, စာပို့ပုံး, မှတ်ပုံတင်စာ, ပါဆယ်ထုတ်, စာတိုက်ပုံး, စာပို့စနစ်, စာအိတ်, စာတိုက်ဌာန, ပါဆယ်ထုပ်"
1F5F3-FE0F,🗳️,ballot box with ballot,"မဲပုံး, မဲထည့်, ဆန္ဒမဲ, ရွေးကောက်ပွဲ, မဲပေး, မဲလိပ်, မဲပြား, မဲဆန္ဒရှင်, မဲစင်တာ, ရွေးကောက်ပွဲကော်မရှင်"
270F-FE0F,✏️,pencil,"ခဲတံ, ခဲတံရာ, ခဲတံဖြင့်အရေးအသား, ခဲတံတို, ခဲတံချွန်, ခဲတံခြစ်, ခဲတံဆွဲ, ခဲတံကိုင်, ရုပ်ပုံဆွဲ, စာရေးကိရိယာ"
2712-FE0F,✒️,black nib,"ဘောပင်ထိပ်ဖျား, ကလောင်သွား, အမည်းရောင်ကလောင်သွား, စာရေးကိရိယာ, မှတ်တမ်းတင်, ကလောင်တံ, ရုံးသုံးပစ္စည်း, ရေးသားခြင်း, မှတ်စု, လက်ရေးလှစတိုင်"
1F58B-FE0F,🖋️,fountain pen,"ဖောင်တိန်, ကလောင်, ကလောင်တံ, မှင်တံ, စာရေးကိရိယာ, စာရေးကိရိယာ, မင်တံ, ဘောပင်, ကလောင်ဦး, စာရေးရန်"
1F58A-FE0F,🖊️,pen,"ဘောပင်, ကလောင်, ကလောင်တံ, ရေးခြစ်, စာရေး, စာရေးကိရိယာ, မင်တံ, မှတ်စုရေးရန်, လက်ရေး, စာစီစာကုံး"
