Hex,Emoji,English Name,Extra keywords
1F600,😀,grinning face,"ပြုံးနေသောမျက်နှာ, ရယ်မော, ပျော်ရွှင်, သွားဖြဲပြ, မျက်နှာပွင့်လန်း, ရွှင်လန်း, ပျော်ရွှင်သောမျက်နှာ, သဘောကျ, အားရပါးရ, ပြုံးရယ်နေသည်"
1F603,😃,grinning face with big eyes,"ပြုံးနေသောမျက်နှာ, ရယ်မော, ပျော်ရွှင်, သွားဖြဲပြ, မျက်နှာပွင့်လန်း, ကြည်နူး, ဝမ်းသာ, ရယ်မောခြင်း, ပျော်ရွှင်ခြင်း, မျက်နှာကြည်လင်"
1F604,😄,grinning face with smiling eyes,"ပြုံးနေသောမျက်နှာ, ရယ်မော, ပျော်ရွှင်, သွားဖြဲပြ, မျက်နှာပွင့်လန်း, ရွှင်လန်း, ပျော်ရွှင်သောမျက်နှာ, သဘောကျ, အားရပါးရ, ပြုံးရယ်နေသည်"
1F601,😁,beaming face with smiling eyes,"ပြုံးနေသောမျက်နှာ, ရယ်မော, ပျော်ရွှင်, သွားဖြဲပြ, မျက်နှာပွင့်လန်း, ကြည်နူး, ဝမ်းသာ, ရယ်မောခြင်း, ပျော်ရွှင်ခြင်း, မျက်နှာကြည်လင်"
1F606,😆,grinning squinting face,"ပြုံးနေသောမျက်နှာ, ရယ်မော, ပျော်ရွှင်, သွားဖြဲပြ, မျက်နှာပွင့်လန်း, ရွှင်လန်း, ပျော်ရွှင်သောမျက်နှာ, သဘောကျ, အားရပါးရ, ပြုံးရယ်နေသည်"
1F605,😅,grinning face with sweat,"ချွေးပြန်, အဆင်ပြေတယ်, အိုကေပါ, ရပါတယ်, ရတယ်, စိတ်လှုပ်ရှားခြင်း, အနေရခက်ခြင်း, ရှက်ကိုးရှက်ကန်း, သက်ပြင်းချခြင်း, အားတုံ့အားနာဖြစ်ခြင်း"
1F923,🤣,rolling on the floor laughing,"တဟားဟားရယ်, အူလှိုက်သည်းလှိုက်ရယ်, ရယ်လွန်းလို့ဗိုက်အောင့်, ခွီရ, အူတက်အောင်ရယ်ရ, ရယ်မောခြင်း, ပျော်ရွှင်ခြင်း, ကြည်နူး, ဝမ်းမြောက်, ရွှင်မြူးသော"
1F602,😂,face with tears of joy,"ရယ်မော, အူလှိုက်သည်းလှိုက်ရယ်, မျက်ရည်ထွက်အောင်ရယ်ရ, အရမ်းရယ်ရ, ဟာသဖြစ်, ကြည်နူး, ဝမ်းသာ, ရယ်မောခြင်း, ပျော်ရွှင်ခြင်း, မျက်နှာကြည်လင်"
1F642,🙂,slightly smiling face,"ပြုံးနေသောမျက်နှာ, ရယ်မော, ပျော်ရွှင်, သွားဖြဲပြ, မျက်နှာပွင့်လန်း, ကြည်နူး, ဝမ်းသာ, ရယ်မောခြင်း, ပျော်ရွှင်ခြင်း, မျက်နှာကြည်လင်"
1F643,🙃,upside-down face,"ပြောင်းပြန်မျက်နှာ, ရွှဲ့, သရော်, နောက်ပြောင်, စိတ်ပျက်, ရွံစရာ, သဘောမတူ, ဟန်ဆောင်ခြင်း, လှောင်ပြောင်ခြင်း, ရယ်စရာ, ရူးကြောင်ကြောင်, ထူးဆန်းသော"
1FAE0,🫠,melting face,"အရည်ပျော်နေသောမျက်နှာ, မျက်နှာပူတယ်, မျက်နှာငယ်တယ်, ရှက်ကိုးရှက်ကန်းဖြစ်, အိုက်စပ်စပ်နိုင်, ပူအိုက်လွန်းသော, စိတ်ပျက်အားငယ်, ရှက်လွန်း၍ပုန်းချင်စိတ်ပေါက်, သည်းမခံနိုင်တော့ခြင်း, အရည်ပျော်လောက်အောင်ချစ်ဖို့ကောင်းသော"
1F609,😉,winking face,"မျက်စိတစ်ဖက်မှိတ်ပြ, မျက်စိမှိတ်ပြ, စနောက်, အရွှန်းဖောက်, လျှို့ဝှက်ချက်ရှိ, မျက်တောင်ခတ်, မျက်စိမှိတ်, သဘောကျ, ကျီစယ်, ရယ်စရာ"
1F60A,😊,smiling face with smiling eyes,"ပြုံးနေသောမျက်နှာ, ရယ်မော, ပျော်ရွှင်, သွားဖြဲပြ, မျက်နှာပွင့်လန်း, ကြည်နူး, ဝမ်းသာ, ရယ်မောခြင်း, ပျော်ရွှင်ခြင်း, မျက်နှာကြည်လင်"
1F607,😇,smiling face with halo,"ကောင်းကင်တမန်, နတ်သားလေး, ရိုးသားသူ, အပြစ်ကင်းစင်သူ, လိမ္မာသူ, ကောင်းချီးပေးခြင်း, ဆုတောင်းခြင်း, ကြင်နာသူ, ကူညီတတ်သူ, ဟန်ဆောင်ကောင်းသူ"
1F970,🥰,smiling face with hearts,"မျက်နှာပွင့်လန်း, အသည်းယားစရာ, ချစ်စရာကောင်း, ရင်ခုန်, သဘောကျ, ကြည်နူးခြင်း, မြတ်နိုးခြင်း, သာယာခြင်း, စွဲလမ်းခြင်း, ချစ်ခင်ခြင်း"
1F60D,😍,smiling face with heart-eyes,"ချစ်စရာကောင်းသော, အသည်းပုံမျက်လုံး, ချစ်မေတ္တာ, စွဲလန်း, နှစ်သက်သဘောကျ, နှလုံးပုံစံ မျက်လုံးများနှင့် အပြုံးမျက်နှာ, အချစ်, အပြုံး, မျက်စိ, မျက်နှာ"
1F929,🤩,star-struck,"မျက်လုံးထဲမှာကြယ်ပွင့်, အံ့ဩမှင်သက်, အားကျ, အလွန်အမင်းသဘောကျ, စိတ်လှုပ်ရှား, ကြည်ညို, အံ့ဩတကြီးဖြစ်, စွဲလမ်း, မော်ကြည့်, ကြွေဆင်း"
1F618,😘,face blowing a kiss,"နမ်းတယ်, အနမ်း, ချစ်တယ်, အနမ်းပေးတာ, မွမွ, မြတ်နိုး, အချစ်, အနမ်းခြွေသည်, နှုတ်ခမ်းချင်းတိုက်သည်, သဘောကျသည်"
1F617,😗,kissing face,"နမ်း, အနမ်းပေး, ချစ်ခင်, နှုတ်ခမ်းစူ, အသံပေးခေါ်, အနမ်းခြွေ, နှုတ်ဆက်, မျက်နှာပေး, ချစ်စရာ, အသည်းယားမှု့"
263A-FE0F,☺️,smiling face,"ပြုံးနေသောမျက်နှာ, ရယ်မော, ပျော်ရွှင်, သွားဖြဲပြ, မျက်နှာပွင့်လန်း, ရွှင်လန်း, ပျော်ရွှင်သောမျက်နှာ, သဘောကျ, အားရပါးရ, ပြုံးရယ်နေသည်"
1F61A,😚,kissing face with closed eyes,"မျက်လုံးမှိတ်ပြီးနမ်းနေသောမျက်နှာ, အသည်းယားစရာ, ချစ်စရာ, အနမ်းပေး, အနမ်းခြွေ, မြတ်နိုး, အချစ်ပို, နွေးထွေး, ကြင်နာ, မေတ္တာရှိသော"
1F619,😙,kissing face with smiling eyes,"နှုတ်ခမ်းစူ, နမ်းရှုံ့, အချိုပေး, မျက်နှာချိုသွေး, ချစ်စဖွယ်ကောင်း, ကြည်နူး, ဝမ်းသာ, ရယ်မောခြင်း, ပျော်ရွှင်ခြင်း, မျက်နှာကြည်လင်"
1F972,🥲,smiling face with tear,"မျက်ရည်နှင့်အပြုံး, ဝမ်းသာမျက်ရည်, ကြိတ်မှိတ်ခံစား, ဟန်ဆောင်ပြုံး, နာကျင်မှုကိုအံတု, ဝမ်းနည်းပက်လက်, စိတ်မကောင်းဖြစ်ရခြင်း, ဒုက္ခကြားကအပြုံး, ကြေကွဲဝမ်းနည်း, မျက်ရည်ဝိုင်းလျက်ပြုံးသည်"
1F60B,😋,face savoring food,"စားကောင်းတယ်, အရသာရှိတယ်, ရှာလပတ်ရည်, သွားရည်ကျတယ်, အီစိမ့်နေတာပဲ, မုန့်ဟင်းခါး, လက်ဖက်သုပ်, ရှမ်းခေါက်ဆွဲ, ငါးပိ, အုန်းနို့ခေါက်ဆွဲ"
1F61B,😛,face with tongue,"လျှာထုတ်ပြ, ပြောင်ချော်ချော်လုပ်, နောက်ပြောင်, စနောက်, ဟာသလုပ်, ပျော်ရွှင်ခြင်း, ကြည်နူး, ချစ်စဖွယ်, ရယ်မော, သဘောကျတာ"
1F61C,😜,winking face with tongue,"နောက်ပြောင်, စနောက်, မျက်စိမှိတ်ပြ, လျှာထုတ်ပြ, ပျော်ရွှင်, ကျီစယ်, ပြောင်ချော်ချော်, ဟာသ, ရွှေပြောင်း, ရယ်ရွှင်သော"
1F92A,🤪,zany face,"ကြောင်တောင်တောင်, မျက်နှာပြောင်, အရူး, ဟာသ, silly, ဇယားရှုပ်, အရူးလုပ်, ပေါကြောင်ကြောင်, မျက်နှာပြောင်ခြင်း, ရယ်စရာကောင်းသော, ကြောင်တောင်တောင်နိုင်သော, နောက်ပြောင်သော, ပေါတောတော"
1F61D,😝,squinting face with tongue,"လျှာထုတ်ပြ, ပြောင်ချော်ချော်နိုင်, နောက်ပြောင်, ရယ်စရာကောင်း, ပျော်ရွှင်, စနောက်ခြင်း, ရယ်မောခြင်း, ဟာသ, အူမြူးခြင်း, မြူးတူးခြင်း"
1F911,🤑,money-mouth face,"ပိုက်ဆံမက်, ငွေဂုဏ်မောက်, ကြွယ်ဝ, ချမ်းသာ, လောဘကြီး, စီးပွားတက်, ငွေဝင်, အောင်မြင်မှု, အခွင့်အလမ်း, လာဘ်ရွှင်"
1F917,🤗,smiling face with open hands,"ဖက်လှဲတကင်းရှိ, နွေးထွေးပျူငှာ, ကြိုဆို, ကျေးဇူးတင်, ဝမ်းသာအားရဖြစ်, ပွေ့ဖက်, ချစ်ခင်, ဖော်ရွေ, ရင်းနှီး, ကူညီချင်စိတ်ရှိသော"
1F92D,🤭,face with hand over mouth,"ပါးစပ်ပိတ်ရယ်, ရှက်ပြုံး, ခိုးရယ်, ရယ်ကျဲကျဲလုပ်, အူတူတူအတတဖြစ်, မျက်နှာဖုံးထားခြင်း, တိုးတိုးလေးရယ်ခြင်း, ရှက်ကိုးရှက်ကန်းဖြစ်ခြင်း, အူကြောင်ကြောင်ဖြစ်ခြင်း, ပါးစပ်ပိတ်ပြုံးခြင်း"
1FAE2,🫢,face with open eyes and hand over mouth,"အံ့သြ, အံ့သြမှင်သက်, ထိတ်လန့်, ပါးစပ်အုပ်, အိုခေါင်း, ကြောက်လန့်, အံ့အားသင့်, ပါးစပ်ပိတ်, ရုတ်တရက်, ထိတ်လန့်တုန်လှုပ်"
1FAE3,🫣,face with peeking eye,"မျက်နှာပူတယ်, ရှက်ကိုးရှက်ကန်းဖြစ်တယ်, ချောင်းကြည့်တယ်, စပ်စုတယ်, ရင်ခုန်တုန်လှုပ်တယ်, ကြောက်လန့်တယ်, တုန်လှုပ်တယ်, အကဲခတ်တယ်, စိုးရိမ်တယ်, လန့်ဖျတ်တယ်"
1F92B,🤫,shushing face,"တိတ်တိတ်နေပါ, အသံမထွက်နဲ့, ရှူးတိုးတိုး, လျှို့ဝှက်ချက်, မပြောနဲ့ဦး, တိုးတိုးနေပါ, အသံထိန်းပါ, ပါးစပ်ပိတ်ထားပါ, နှုတ်ပိတ်ပါ, ငြိမ်ငြိမ်နေပါ"
1F914,🤔,thinking face,"စဉ်းစားနေသည်, တွေးတော, အကြံထုတ်, စဉ်းစားခန်းဖွင့်, ချင့်ချိန်, တွေးတောနေသည်, စဉ်းစားချင့်ချိန်, အကြံထုတ်နေသည်, အလေးအနက်ထား, စိတ်ကူးနေသည်"
1FAE1,🫡,saluting face,"အလေးပြု, စစ်သည်တော်နှုတ်ဆက်, လေးစားမှုကိုပြသ, အမိန့်နာခံ, ဟုတ်ကဲ့ပါခင်ဗျာ, လေးစားပါတယ်, မင်္ဂလာပါ, နာခံလျက်, ဂါရဝပြုခြင်း, ဂုဏ်ပြုသည်"
1F910,🤐,zipper-mouth face,"လျှို့ဝှက်ချက်စောင့်ထိန်း, နှုတ်ပိတ်နေ, ပါးစပ်ပိတ်ထား, ဘာမှမပြော, လျှို့ဝှက်ထားပါ, တိတ်ဆိတ်ခြင်း, နှုတ်ဆိတ်နေခြင်း, လျှို့ဝှက်ချက်, စကားမပြောခြင်း, အသံတိတ်နေခြင်း"
1F928,🤨,face with raised eyebrow,"သံသယဖြစ်, မယုံကြည်, ဟုတ်လို့လား, တကယ်လား, ဘယ်လိုပြောလဲ, မသင်္ကာဖြစ်, စဉ်းစားနေတယ်, နားမလည်ဘူး, မဟုတ်တန်ရာ, အံ့သြတယ်"
1F610,😐,neutral face,"သာမန်မျက်နှာ, ပုံမှန်ပဲ, အေးဆေးပဲ, ဘာမှမဖြစ်သလိုပဲ, ပြုပြင်ပြောင်းလဲမှုမရှိသောမျက်နှာ, တုံ့ပြန်မှုမရှိသောမျက်နှာ, ခံစားချက်မရှိသောမျက်နှာ, ပုံသေမျက်နှာထား, မထူးခြားနားသောမျက်နှာ, တည်ငြိမ်သောမျက်နှာထား"
1F611,😑,expressionless face,"ဘာမှမထူးခြားသောမျက်နှာ, အမူအရာကင်းမဲ့သောမျက်နှာ, ခံစားချက်မရှိသောမျက်နှာ, စိတ်ပျက်စရာ, ငြီးငွေ့စရာ, မျက်နှာသေ, အေးစက်စက်မျက်နှာ, တည်ငြိမ်သောမျက်နှာ, ဂရုမစိုက်သောမျက်နှာ, အာရုံမရှိသောမျက်နှာ"
1F636,😶,face without mouth,"ပြောစရာစကားမရှိ, ဆွံ့အသွား, နှုတ်ဆိတ်နေ, ဘာပြောရမှန်းမသိ, တစ်ကိုယ်တည်းဖြစ်, အထီးကျန်ခြင်း, စိတ်ပျက်အားငယ်ခြင်း, အရှက်ရခြင်း, စကားမပြောနိုင်ခြင်း, နှုတ်ဆိတ်နေခြင်း"
1FAE5,🫥,dotted line face,"မျက်ကွယ်ပြုခံရ, ပစ်ပယ်ခံရ, အရေးမပါသလိုခံစားရ, ဖျောက်ဖျက်ပစ်ချင်, အထီးကျန်, မျက်ကွယ်ပြုထားခြင်း, ပျောက်ကွယ်သွားခြင်း, မသေချာခြင်း, စိတ်ဓာတ်ကျခြင်း, ရှက်ရွံ့ခြင်း"
1F636-200D-1F32B-FE0F,😶‍🌫️,face in clouds,"တိမ်ဖုံးနေသောမျက်နှာ, မြူပိတ်နေ, မူးဝေ, ဆေးလိပ်သောက်, စိတ်ရှုပ်ထွေး, ရှက်ရွံ့ခြင်း, အလုပ်ရှုပ်နေသော, မသဲကွဲသော, အတွေးလွန်နေခြင်း, ငေးငိုင်နေခြင်း"
1F60F,😏,smirking face,"အပြုံးခိုး, မျက်နှာချိုသွေး, မထီမဲ့မြင်ပြုံး, လူလည်ပြုံး, ပြုံးစိစိလုပ်, မာယာပါသောပြုံး, လှောင်ပြုံး, မျက်စိမှိတ်ပြုံး, ကောက်ကျစ်သောပြုံး, ဟန်ဆောင်ပြုံး"
1F612,😒,unamused face,"မဲ့ကဲ့ရဲ့, မဲ့ရွဲ့, မျက်မှောင်ကြုတ်, မကျေနပ်, အလိုမကျ, စိတ်ပျက်, စိတ်ကုန်, ငြီးငွေ့, မနှစ်သက်, မျက်နှာလွှဲ"
1F644,🙄,face with rolling eyes,"မျက်လုံးအပေါ်လန်, အမြင်ကတ်, စိတ်ပျက်, ငြီးငွေ့, လှောင်ပြောင်, မယုံကြည်နိုင်ခြင်း, စိတ်တိုခြင်း, စိတ်မရှည်ခြင်း, အထင်သေးခြင်း, သရော်ခြင်း"
1F62C,😬,grimacing face,"မျက်နှာပူတယ်, မျက်နှာငယ်တယ်, အားငယ်တယ်, တောဆန်, ပေါတောတော, မျက်နှာပေးတယ်, မျက်နှာသာပေးတယ်, မျက်နှာရတယ်, မျက်နှာပျက်တယ်, မျက်နှာပြောင်တိုက်တယ်"
1F62E-200D-1F4A8,😮‍💨,face exhaling,"သက်ပြင်းချ, စိတ်ပျက်, ပင်ပန်းနွမ်းနယ်, စိတ်သက်သာရာရ, အမောဖြေ, မောတယ်, စိတ်မောတယ်, မောပန်းခြင်း, သက်ပြင်းချခြင်း, အသက်ရှူထုတ်ခြင်း"
1F925,🤥,lying face,"လိမ်ညာနေသောမျက်နှာ, နှာခေါင်းရှည်, လိမ်ပြော, မမှန်မကန်ပြော, ပိနိုခီယို, ညာတာ, လိမ်ညာခြင်း, မမှန်မကန်, လှည့်ဖြားခြင်း, သစ္စာမရှိသော"
1FAE8,🫨,shaking face,"တုန်ခါနေသောမျက်နှာ, တုန်လှုပ်, ထိတ်လန့်, ကြောက်လန့်, ရှော့ခ်ရ, မူးဝေခြင်း, လှုပ်ခါနေသော, အံ့အားသင့်, စိုးရိမ်, တုန်လှုပ်ချောက်ချားခြင်း"
1F642-200D-2194-FE0F,🙂‍↔️,head shaking horizontally,"ခေါင်းခါ, မဟုတ်ဘူး, ငြင်းပယ်, လက်မခံ, မလုပ်ဘူး, သဘောမတူ, ကန့်ကွက်, ငြင်းဆို, မဟုတ်ပါ, ပယ်ချ"
1F642-200D-2195-FE0F,🙂‍↕️,head shaking vertically,"ခေါင်းညိတ်, ဟုတ်ကဲ့, အင်း, သဘောတူသည်, လက်ခံသည်, သဘောတူညီချက်, ဝန်ခံသည်, မှန်ကန်သည်, ဟုတ်မှန်သည်, သဘောကျသည်"
1F60C,😌,relieved face,"စိတ်သက်သာရာရ, စိတ်အေးသွား, အပူအပင်ကင်း, အေးအေးလူလူ, ကျေနပ်, ငြိမ်းချမ်း, အပန်းဖြေ, စိတ်လက်ပေါ့ပါး, သက်သောင့်သက်သာ, ပျော်ရွှင်ဝမ်းမြောက်"
1F614,😔,pensive face,"ဝမ်းနည်း, စိတ်မကောင်းဖြစ်, အားငယ်, မျက်နှာငယ်, စိတ်ညစ်, မျက်နှာပူ, မျက်နှာပျက်, ဝမ်းနည်းပူဆွေး, စိတ်ပျက်, အားကိုးရာမဲ့"
1F62A,😪,sleepy face,"အိပ်ချင်တာ, ငိုက်တာ, ပင်ပန်းတာ, မျက်စိစုံမှိတ်တာ, သမ်းဝေတာ, အိပ်စက်ခြင်း, အိပ်မက်မက်တာ, အနားယူတာ, ကျိန်းစက်တာ, အိပ်ရာဝင်တာ"
1F924,🤤,drooling face,"သွားရည်ကျ, ငမ်းသည်, သွားရည်တများများ, အရသာရှိသော, စားချင်စဖွယ်, စားချင်စဖွယ်ကောင်းသော, လျှာရည်ယိုစရာ, အလွန်အရသာရှိသော, မွှေးကြိုင်သော, သွားရည်ကျစရာ"
1F634,😴,sleeping face,"အိပ်ပျော်နေ, အိပ်ငိုက်, အိပ်ချင်, ပျင်းရိ, ငြီးငွေ့, အိပ်မောကျနေ, အိပ်မက်မက်နေ, မှေးစက်နေ, နားနေသည်, အနားယူနေသည်"
1FAE9,🫩,face with bags under eyes,"မျက်ကွင်းညို, ပင်ပန်းနွမ်းနယ်, အိပ်ရေးပျက်, စိတ်ကုန်, မျက်လုံးအောက်ဖောင်း, နုန်းချိ, အားအင်ကုန်ခမ်း, နုံးနယ်, စိတ်ပျက်, ငြီးငွေ့သေော သွေးပြင်သဏ္ဌာန်"
1F637,😷,face with medical mask,"နှာခေါင်းစည်းတပ်ထားသောမျက်နှာ, နှာခေါင်းစည်း, ပါးစပ်စည်း, Mask တပ်ထား, နေမကောင်းဖြစ်, မျက်နှာဖုံး, မျက်နှာစည်း, နှာခေါင်းစည်းတပ်ဆင်ခြင်း, ကာကွယ်ရန်, နှာခေါင်းအုပ်ခြင်း"
1F912,🤒,face with thermometer,"ဖျားနေတာ, ကိုယ်ပူနေတာ, အဖျားတက်နေတာ, နေမကောင်းဘူး, သာမိုမီတာနဲ့ အဖျားတိုင်းနေတာ, အဖျားရောဂါ, ဖျားနာခြင်း, ကိုယ်ပူတက်တာ, နေမကောင်းဖြစ်တာ, အဖျားတက်နေသည်"
1F915,🤕,face with head-bandage,"ခေါင်းစည်းထားသောမျက်နှာ, ဒဏ်ရာရ, နာကျင်, ခေါင်းပေါက်, ဆေးထည့်ထား, နေမကောင်း, ဒဏ်ရာရရှိထားသူ, ပတ်တီးစည်းထားသည်, ဆေးကုသမှု, နာမကျန်းဖြစ်ခြင်း"
1F922,🤢,nauseated face,"အော့အန်ချင်, အန်ချင်သလိုဖြစ်, ပျို့အန်, အော့အန်, မအီမသာဖြစ်, ခေါင်းမူး, နှာစေး, နှာပိတ်, သွားကိုက်, ဝမ်းလျှော"
1F92E,🤮,face vomiting,"အန်, အော့အန်, အန်ဖတ်, ရွံစရာကောင်းသော, ရွံရှာဖွယ်, မူးနောက်, ပျို့အန်, အော့ကြောလန်, စက်ဆုပ်, အန်ချင်စတေးဖြစ်နေသော"
