Hex,Emoji,English Name,Extra keywords
1F9B9-200D-2640-FE0F,🦹‍♀️,woman supervillain,"အမျိုးသမီး လူကြမ်း, ဗီလိန်မ, လူဆိုးမ, စူပါဗီလိန်, အဖျက်သမား, တန်ခိုးရှင်, မိန်းမဆိုး, ရန်သူ, အဆိုးတကာ့အဆိုးဆုံး, ဗီလိန်အမျိုးသမီး"
1F9D9,🧙,mage,"ဝိဇ္ဇာ, မှော်ဆရာ, အထက်လမ်းဆရာ, အင်းဆရာ, ဆေးဝိဇ္ဇာ, စုန်းကဝေ, ပညာသည်, လောကီဆရာ, ဂါထာဆရာ, မန္တန်ဆရာ"
1F9D9-200D-2642-FE0F,🧙‍♂️,man mage,"ယောက်ျားလေး မှော်ဆရာ, မှော်ဆရာ, အင်းဝိဇ္ဇာ, ဂါထာဆရာ, ပုဂ္ဂိုလ်ထူး, စုန်းကဝေ, ဝိဇ္ဇာ, လောကီပညာရှင်, မန္တန်ဆရာ, အဂ္ဂိရတ်ဆရာ"
1F9D9-200D-2640-FE0F,🧙‍♀️,woman mage,"ဝိဇ္ဇာမ, ကဝေမ, မှော်ဆရာမ, စုန်းမ, အင်းဝိဇ္ဇာ, ဂမ္ဘီရဆရာ, လောကီပညာရှင်, နတ်ကတော်, နတ်ဆရာ, ပုဏ္ဏား"
1F9DA,🧚,fairy,"နတ်သမီး, နတ်မိမယ်, ပုံပြင်ထဲကဇာတ်ကောင်, အလှပဂေး, နတ်ပြည်ကဆင်းသက်လာသူ, နတ်သမီးလေး, တောင်စောင့်နတ်, နတ်ဒေဝီ, ဝိဇ္ဇာ, ကောင်းကင်တမန်"
1F9DA-200D-2642-FE0F,🧚‍♂️,man fairy,"နတ်သမီး, နတ်သား, ပုံပြင်ထဲကနတ်သား, အခြောက်, ဂန်ဒူး, နတ်သားလေး, ဒဏ္ဍာရီလာပုဂ္ဂိုလ်, တန်ခိုးရှင်, မှော်အတတ်ပညာရှင်, နတ်ဒေဝတာ"
1F9DA-200D-2640-FE0F,🧚‍♀️,woman fairy,"နတ်သမီး, နတ်မိမယ်, လှပသောမိန်းကလေး, နတ်ဘုရားမ, သုဇာ, နတ်သမီးပုံပြင်, မှော်အတတ်, တောင်ပံ, ကောင်းကင်ဘုံ, နတ်မိဖုရား"
1F9DB,🧛,vampire,"သွေးစုပ်ဖုတ်ကောင်, သွေးစုပ်ကောင်, ဖုတ်ကောင်, ကေဖုန်း, သွေးစုပ်မြေဖုတ်, သွေးစုပ်မြေဖုတ်ကောင်, သရဲ, တစ်ဆေ, ပြိတ္တာ, သရဲသဘက်"
1F9DB-200D-2642-FE0F,🧛‍♂️,man vampire,"သွေးစုပ်ဖုတ်ကောင်, သွေးစုပ်ကောင်, ဖုတ်ကောင်, ဝိညာဉ်နှိုက်သူ, ကျိန်စာသင့်သူ, ကပ်ဖုန်း, သွေးစုပ်ဖုတ်ကောင်အမျိုးသား, မှော်ဆရာဖုတ်ကောင်, ဝိညာဉ်စားသူ, အမှောင်လောကသား"
1F9DB-200D-2640-FE0F,🧛‍♀️,woman vampire,"သွေးစုပ်ဖုတ်ကောင်, သွေးစုပ်ဖုတ်ကောင်မ, ဖုတ်ကောင်, သွေးစုပ်မြှောင်, သွေးစုပ်သောမိန်းမလှ, သရဲ, ဘီလူးမ, ကြောက်စရာ, သွေးစုပ်ကောင်, သေမင်းတမန်"
1F9DC,🧜,merperson,"ရေသူမ, ရေသူထီး, ရေသူလူမျိုး, ပင်လယ်စောင့်နတ်, မာမိဒ်, မိန်းမတပိုင်းငါးတပိုင်း, ရေသူ, နဂါးမ, ကလူးမ, ရေနတ်မ"
1F9DC-200D-2642-FE0F,🧜‍♂️,merman,"ရေသူသား, မာမန်, ပင်လယ်လူသား, ငါးလူသား, ရေနတ်သား, ပင်လယ်ဖုတ်ကောင်, ရေသတ္တဝါ, ဒဏ္ဍာရီလာလူသား, ရေသူ, အဏ္ဏဝါလုလင်"
1F9DC-200D-2640-FE0F,🧜‍♀️,mermaid,"ရေသူမ, မိန်းမတပိုင်းငါးတပိုင်း, ရေသူမလေး, ပင်လယ်စောင့်နတ်သမီး, နဂါးမင်းသမီး, ဒဏ္ဍာရီလာသတ္တဝါ, ပင်လယ်ကညာ, ရေနတ်သမီး, ရှေးဟောင်းပန်းချီ, မြန်မာ့ရိုးရာပုံပြင်"
1F9DD,🧝,elf,"နတ်မိမယ်, နတ်သား, ဂိမ်းထဲကကောင်, အန်းနင်း, နားရွက်ချွန်ချွန်နှင့်လူသား, ဒဏ္ဍာရီလာပုဂ္ဂိုလ်, တောစောင့်နတ်, မှော်ဆရာ, တောနတ်, နတ်ဒေဝါ"
1F9DD-200D-2642-FE0F,🧝‍♂️,man elf,"နတ်သမီး, နတ်သား, အက်ဖ်, ဒဏ္ဍာရီလာပုဂ္ဂိုလ်, နားရွက်ချွန်နှင့်လူသား, ပုဂ္ဂိုလ်ငယ်, မျက်လှည့်ဆရာ, တောစောင့်နတ်, ဂမ္ဘီရသတ္တဝါ, နတ်ငယ်လေးများ"
1F9DD-200D-2640-FE0F,🧝‍♀️,woman elf,"အမျိုးသမီး နတ်သမီး, နတ်မိမယ်, အလှပနတ်သမီး, အချောအလှ, နတ်သမီးပုံပြင်, နားရွက်ချွန်သည့်မိန်းကလေး, ဒဏ္ဍာရီလာသတ္တဝါ, တောစောင့်နတ်သမီး, မှော်အတတ်သုံးနိုင်သူ, လှပသောနတ်မျိုးနွယ်"
1F9DE,🧞,genie,"ဂျင်းနီ, မီးခွက်စောင့်ဘီလူး, တန်ခိုးရှင်, ဆုတောင်းပြည့်စေသူ, မျက်လှည့်ပြသူ, ဒေဝတာ, နတ်သား, နတ်သမီး, ဝိဇ္ဇာ, အစောင့်အရှောက်နတ်"
1F9DE-200D-2642-FE0F,🧞‍♂️,man genie,"ဘီလူး, နတ်ဆိုး, မှော်ဘီလူး, တန်ခိုးရှင်, ဆုတောင်းပေးသူ, မှော်ဆရာ, တန်ခိုးရှင်, နတ်ဘုရား, အစောင့်အရှောက်, အံ့ဖွယ်လူသား"
1F9DE-200D-2640-FE0F,🧞‍♀️,woman genie,"ဂျီနီမ, မီးခွက်စောင့်ဘီလူးမ, နတ်သမီး, တန်ခိုးရှင်, ဆန္ဒဖြည့်ပေးသူ, အစောင့်နတ်, မှော်ဆရာမ, တန်ခိုးရှင်မ, ဆုတောင်းပြည့်, အံ့ဖွယ်မင်းသမီး"
1F9DF,🧟,zombie,"ဖုတ်ကောင်, သရဲ, လူသေ, ကြောက်စရာ, အသည်းယားစရာ, တစ္ဆေ, သေမင်း, ဦးနှောက်စားသော, ထိတ်လန့်စရာ, အကောင်စုတ်"
1F9DF-200D-2642-FE0F,🧟‍♂️,man zombie,"ဇမ်ဘီ, လူသေကောင်, သေလူ, ဖုတ်ကောင်, သေမင်းတမန်, သရဲ, ကြောက်စရာ, ဟော်ရာ, အရိုးစု, အလောင်းစို့"
1F9DF-200D-2640-FE0F,🧟‍♀️,woman zombie,"သေလူ, ဖုတ်ကောင်, ဇွန်ဘီ, အသေကောင်, သရဲမ, ခြောက်ခြားဖွယ်, ကြောက်စရာကောင်းသော, သရဲသဘက်, လူသေကောင်, ထိတ်လန့်ဖွယ်ရာ"
1F9CC,🧌,troll,"ဂျင်း, ဂျင်းထည့်, လှည့်စား, နောက်ပြောင်, အနှောင့်အယှက်ပေးသူ, နီပေါ, မျက်ခုံးမွှေးစင်္ကြန်လျှောက်, ဆူးလှည်းကြီးမောင်း, လက်တစ်လုံးကြား, သရော်စာ"
1F486,💆,person getting massage,"နှိပ်နယ်ပေး, အနှိပ်ခံ, ဇိမ်ခံ, အပန်းဖြေ, ခေါင်းနှိပ်, နေသာထိုင်သာရှိခြင်း, ကိုယ်လက်နှိပ်နယ်ခြင်း, ညောင်းညာမှုကိုဖြေဖျောက်ခြင်း, စိတ်အပန်းပြေခြင်း, အကြောလျှော့ခြင်း"
1F486-200D-2642-FE0F,💆‍♂️,man getting massage,"အနှိပ်ခံနေသူ, နှိပ်နယ်, အညောင်းအညာဖြေ, အနှိပ်ခန်း, အမျိုးသားသီးသန့်အနှိပ်ခန်း, ကျန်းမာရေး, အကြောပြင်, အပန်းဖြေ, ကုထုံး, အကြောဖြေနည်း"
1F486-200D-2640-FE0F,💆‍♀️,woman getting massage,"ခေါင်းလျှော်, ခေါင်းနှိပ်, အနှိပ်ခံ, စပာာ, အလှအပပြုပြင်, အသားအရေထိန်းသိမ်းမှု, စိတ်အပန်းဖြေခြင်း, ကျန်းမာရေး, ကိုယ်လက်နှိပ်နယ်ခြင်း, အလှအပရေးရာ"
1F487,💇,person getting haircut,"ဆံပင်ညှပ်, ဆံပင်ပုံသွင်း, အလှပြင်, ဆံပင်ညှပ်ဆိုင်, ဘာဘာဆိုင်, ဆံပင်ညှပ်ဆရာ, ကတ်ကြေး, မှန်, အလှပြင်ဆိုင်, ခေါင်းလျှော်"
1F487-200D-2642-FE0F,💇‍♂️,man getting haircut,"ဆံပင်ညှပ်, ဆံပင်ညှပ်သမား, ဆံပင်ညှပ်ဆိုင်, ကေညှပ်, ဆံပင်ပုံသွင်း, ဆံပင်အလှပြင်ဆိုင်, ဆံပင်ညှပ်ခုံ, ဆံပင်ညှပ်ကတ်ကြေး, ဘာဘာ, ဆံပင်ညှပ်ခြင်း"
1F487-200D-2640-FE0F,💇‍♀️,woman getting haircut,"ဆံပင်ညှပ်, ဆံပင်ညှပ်ဆိုင်, အလှပြင်ဆိုင်, ကေညှပ်တာ, ဆံပင်ပုံစံပြောင်းတာ, ဆံပင်ညှပ်ဆရာ, ဆံပင်ညှပ်မည့်သူ, ဆံပင်ညှပ်စက်, ဆံပင်ညှပ်ကပ်ကြေး, ဆံကေသာအလှပြင်ခြင်း"
1F6B6,🚶,person walking,"လမ်းလျှောက်, ခြေကျင်လျှောက်, လမ်းသလား, လမ်းလျှောက်ထွက်, လမ်းလျှောက်နေသူ, လျှောက်လှမ်း, ခြေလှမ်း, ခရီးသွား, အပန်းဖြေလမ်းလျှောက်, လမ်းလျှောက်ထွက်ခြင်း"
1F6B6-200D-2642-FE0F,🚶‍♂️,man walking,"လမ်းလျှောက်နေသူ, ခြေလျင်လျှောက်, လမ်းလျှောက်ထွက်, အေးအေးလူလူလျှောက်, ခြေလှမ်းမှန်မှန်လျှောက်, လျှောက်လှမ်းခြင်း, ခြေကျင်ခရီး, လမ်းလျှောက်လေ့ကျင့်ခန်း, အပန်းဖြေလမ်းလျှောက်ခြင်း, ခြေကျင်သွားသည်"
1F6B6-200D-2640-FE0F,🚶‍♀️,woman walking,"လမ်းလျှောက်နေသူ, လမ်းလျှောက်, ခြေကျင်သွား, အပြင်ထွက်, လေ့ကျင့်ခန်းလုပ်, လမ်းလျှောက်ထွက်ခြင်း, လမ်းလျှောက်အားကစား, ခြေကျင်ခရီး, လမ်းလျှောက်ခြင်း, လှုပ်ရှားမှုုပြုလုပ်ခြင်း"
1F6B6-200D-27A1-FE0F,🚶‍➡️,person walking facing right,"လမ်းလျှောက်နေသူ, ညာဘက်သို့လမ်းလျှောက်နေသူ, ရှေ့ဆက်နေသူ, ခရီးသွားနေသူ, လမ်းလျှောက်, လှုပ်ရှားမှု, ခြေကျင်, လျှောက်လှမ်းခြင်း, အပြင်ထွက်ခြင်း, လေ့ကျင့်ခန်း"
1F6B6-200D-2640-FE0F-200D-27A1-FE0F,🚶‍♀️‍➡️,woman walking facing right,"လမ်းလျှောက်နေသော အမျိုးသမီး, ညာဘက်သို့ လမ်းလျှောက်နေသည်, ခရီးသွားနေသည်, အရှေ့သို့ လှမ်းတက်, တက်ကြွလှုပ်ရှား, မြန်မာအမျိုးသမီး, လမ်းလျှောက်နေသည်, ခြေလှမ်း, အပြင်ထွက်ခြင်း, လှုပ်ရှားမှု"
1F6B6-200D-2642-FE0F-200D-27A1-FE0F,🚶‍♂️‍➡️,man walking facing right,"လမ်းလျှောက်နေသူ, ခြေကျင်လျှောက်, ရှေ့ဆက်, ခရီးသွား, လေ့ကျင့်ခန်းလုပ်, ညာဘက်, ဘယ်ဘက်, လမ်းလျှောက်ခြင်း, လမ်းကြောင်း, လှုပ်ရှားမှု"
1F9CD,🧍,person standing,"မတ်တပ်ရပ်နေသူ, လူတစ်ယောက်, မတ်တပ်ရပ်, ကိုယ်ဟန်အနေအထား, ရပ်, မတ်တပ်, ရပ်နေသည်, လူ, ကိုယ်ဟန်, အနေအထား"
1F9CD-200D-2642-FE0F,🧍‍♂️,man standing,"မတ်တပ်ရပ်နေသူ, အမျိုးသား, မတ်တပ်ရပ်, လူ, အလေးအနက်ထား, ရပ်, အထီး, ရပ်နေသည်, ကိုယ်ဟန်အနေအထား, မတ်တပ်"
1F9CD-200D-2640-FE0F,🧍‍♀️,woman standing,"မတ်တပ်ရပ်နေသော အမျိုးသမီး, မိန်းကလေး, မတ်တပ်ရပ်, ကိုယ်ဟန်အနေအထား, လူပုံရိပ်, အမျိုးသမီး, မတ်တပ်ရပ်လျက်, လူပုဂ္ဂိုလ်, မတ်တပ်, ကိုယ်ဟန်အမူအရာ"
1F9CE,🧎,person kneeling,"ဒူးထောက်, ရှိခိုး, ဂါရဝပြု, ကန်တော့, ဝပ်တွား, ဦးချ, ဒူးထောက်ခြင်း, ရိုသေခြင်း, ရှိခိုးပူဇော်, ဒူးတုပ်ခြင်း"
1F9CE-200D-2642-FE0F,🧎‍♂️,man kneeling,"ဒူးထောက်, ဝတ်ပြု, တောင်းပန်, ရိုသေ, ဂါရဝပြု, ဦးချ, ရှိခိုး, ဒူးထောက်ခြင်း, တောင်းပန်တိုးလျှိုး, ဝတ်ပြုကိုးကွယ်ခြင်း"
1F9CE-200D-2640-FE0F,🧎‍♀️,woman kneeling,"ဒူးထောက်, ဝတ်ပြု, ဆုတောင်း, ရှိခိုး, ကန်တော့, တရားထိုင်ခြင်း, ငြိမ်းချမ်းရေး, ဘာသာရေး, မေတ္တာပို့, သီလရှင်"
1F9CE-200D-27A1-FE0F,🧎‍➡️,person kneeling facing right,"ဒူးထောက်, ရှိခိုး, ဂါရဝပြု, တောင်းပန်, ဆုတောင်း, ကန်တော့, ဦးချ, ရိုသေ, နာခံ, ဝတ်ပြု"
1F9CE-200D-2640-FE0F-200D-27A1-FE0F,🧎‍♀️‍➡️,woman kneeling facing right,"ဒူးထောက်, ဒူးထောက်နေသောမိန်းကလေး, ဝတ်ပြု, တောင်းပန်, ခယ, ရှိခိုး, ဘုရားဖူး, ဆုတောင်း, ငြိမ်းချမ်းရေး, ကျောင်းအမ"
1F9CE-200D-2642-FE0F-200D-27A1-FE0F,🧎‍♂️‍➡️,man kneeling facing right,"ဒူးထောက်နေသူ, အမျိုးသားဒူးထောက်, လက်အုပ်ချီ, ရှိခိုး, ဆုတောင်း, ဝတ်ပြု, ဦးချ, ဘုရားရှိခိုး, တောင်းပန်, အရိုအသေပေး"
1F9D1-200D-1F9AF,🧑‍🦯,person with white cane,"မျက်မမြင်လက်တံရှည်, မျက်မမြင်တုတ်ကောက်, လမ်းပြတုတ်, အဖြူရောင်လက်တံ, အမြင်အာရုံချို့ယွင်းသူ, မျက်မမြင်အသင်း, အမြင်အာရုံမသန်စွမ်းသူ, လမ်းလျှောက်တုတ်, အကူအညီတောင်းခံခြင်း, လွတ်လပ်စွာသွားလာခြင်း"
1F9D1-200D-1F9AF-200D-27A1-FE0F,🧑‍🦯‍➡️,person with white cane facing right,"ဖြူစင်သောလက်တံကိုင်ဆောင်ထားသူ, မျက်မမြင်အဖြူရောင်လက်တံ, လမ်းပြတုတ်ကိုင်ထားသူ, အမြင်အာရုံချို့ယွင်းသူ, အမြင်အာရုံမသန်စွမ်းသူ, အဖြူရောင်လမ်းပြတုတ်, မျက်မမြင်အသင်း, အမြင်အာရုံချို့ယွင်းသူများနေ့, ကိုယ်ပိုင်လွတ်လပ်ခွင့်, အထောက်အကူပြုပစ္စည်း"
1F468-200D-1F9AF,👨‍🦯,man with white cane,"ဖြူစင်သောလက်ကိုင်တုတ်ကိုင်ဆောင်ထားသည့် မျက်မမြင်အမျိုးသား, မျက်မမြင်, အမြင်အာရုံချို့ယွင်းသူ, အဖြူရောင်လက်ကိုင်တုတ်, လမ်းလျှောက်တုတ်, အမြင်အာရုံမသန်စွမ်းသူ, မျက်မမြင်လမ်းလျှောက်တုတ်, အဖြူရောင်လက်ကိုင်တုတ်နေ့, ကူညီစောင့်ရှောက်သူ, လွတ်လပ်စွာသွားလာနိုင်မှု"
1F468-200D-1F9AF-200D-27A1-FE0F,👨‍🦯‍➡️,man with white cane facing right,"မျက်မမြင်, အမြင်အာရုံချို့ယွင်းသူ, အဖြူရောင်လက်ကိုင်တုတ်, လမ်းပြတုတ်, စမ်းသပ်တုတ်, ကိုယ်ပိုင်လွတ်လပ်ခွင့်, အထောက်အကူပြုပစ္စည်း, အမြင်အာရုံမသန်စွမ်းမှု, လမ်းလျှောက်ခြင်း, သတိပြုမိစေရန်"
1F469-200D-1F9AF,👩‍🦯,woman with white cane,"မျက်မမြင်အမျိုးသမီး, မျက်မမြင်လမ်းပြတုတ်သုံးစွဲသူ, အမြင်အာရုံချို့ယွင်းသူ, အဖြူရောင်လမ်းပြတုတ်, ကိုယ်ပိုင်လွတ်လပ်ခွင့်, အပြည်ပြည်ဆိုင်ရာမျက်မမြင်လမ်းပြတုတ်နေ့, အဖြူရောင်လမ်းပြတုတ်အထိမ်းအမှတ်နေ့, လွတ်လပ်စွာသွားလာနိုင်ခွင့်, အမြင်အာရုံချို့ယွင်းသူများအခွင့်အရေး, လူမှုပတ်ဝန်းကျင်တွင်ပါဝင်ဆောင်ရွက်ခြင်း"
1F469-200D-1F9AF-200D-27A1-FE0F,👩‍🦯‍➡️,woman with white cane facing right,"မျက်မမြင်အမျိုးသမီး, အဖြူရောင်လက်ကိုင်တုတ်, လမ်းလျှောက်နေသူ, အမြင်အာရုံချို့ယွင်းသူ, အကူအညီလိုအပ်သူ, မျက်မမြင်အဖြူရောင်လက်ကိုင်တုတ်နေ့, ကိုယ်ပိုင်လွတ်လပ်ခွင့်, အမြင်အာရုံချို့ယွင်းသူများ, အဖြူရောင်လက်ကိုင်တုတ်လမ်းလျှောက်ပွဲ, ကူညီစောင့်ရှောက်သူများ"
1F9D1-200D-1F9BC,🧑‍🦼,person in motorized wheelchair,"ဘီးတပ်ကုလားထိုင်, ဝှီးချဲလ်, လျှပ်စစ်ဝှီးချဲလ်, အော်တိုဝှီးချဲလ်, မသန်စွမ်းသူ, မသန်စွမ်း, အထိုင်ဘီး, လက်တွန်းလှည်း, ခြေတုလက်တု, ရွေ့လျားသွားလာရေး အကူအညီများ"
1F9D1-200D-1F9BC-200D-27A1-FE0F,🧑‍🦼‍➡️,person in motorized wheelchair facing right,"မော်တာတပ်ဆင်ထားသော ဘီးတပ်ကုလားထိုင်ပေါ်တွင် ညာဘက်သို့မျက်နှာမူထားသောသူ, လျှပ်စစ်ဘီးတပ်ကုလားထိုင်, အော်တိုဘီးတပ်ကုလားထိုင်, မသန်စွမ်းသူ, မသန်စွမ်းအခွင့်အရေး, သွားလာရေးအကူအညီ, ဘီးတပ်ကုလားထိုင်အသုံးပြုသူ, ကိုယ်လက်အင်္ဂါမသန်စွမ်းသူ, ညာဘက်သို့သွားနေသည်, အထူးပြုလုပ်ထားသောဘီးတပ်ကုလားထိုင်"
1F468-200D-1F9BC,👨‍🦼,man in motorized wheelchair,"ဝှီးချဲလ်စီးထားသည့်အမျိုးသား, လျှပ်စစ်ဝှီးချဲလ်, မသန်စွမ်းသူ, မသန်စွမ်းအမျိုးသား, ဘီးတပ်ကုလားထိုင်, ဘီးတပ်ကုလားထိုင်စီးသူ, လျှပ်စစ်ဘီးတပ်ကုလားထိုင်, မသန်စွမ်းသူများ, ရွေ့လျားသွားလာရေးအထောက်အကူပြုပစ္စည်း, အကူအညီလိုအပ်သူ"
1F468-200D-1F9BC-200D-27A1-FE0F,👨‍🦼‍➡️,man in motorized wheelchair facing right,"ဘီးတပ်ကုလားထိုင်စီးနေသူ, မသန်စွမ်းသူ, လျှပ်စစ်ဘီးတပ်ကုလားထိုင်, အော်တိုဘီးတပ်ကုလားထိုင်, လမ်းလျှောက်မရသူ, ဘက်ထရီဘီးတပ်ကုလားထိုင်, အကူအညီလိုအပ်သူ, သွားလာရေးအဆင်ပြေစေရန်, ညာဘက်သို့ဦးတည်နေသူ, စက်တပ်ဘီးတပ်ကုလားထိုင်"
1F469-200D-1F9BC,👩‍🦼,woman in motorized wheelchair,"မော်တာတပ်ဆင်ထားသော ဝှီးချဲလ်စီးနေသည့် အမျိုးသမီး, ဝှီးချဲလ်စီးအမျိုးသမီး, အလိုအလျောက်ဝှီးချဲလ်, မော်တာဝှီးချဲလ်, လျှပ်စစ်ဝှီးချဲလ်, ဘက်ထရီဝှီးချဲလ်, ပါဝါဝှီးချဲလ်, လျှပ်စစ်လူနာတင်ယာဉ်, အလိုအလျောက်ရွေ့လျားကိရိယာ, မသန်စွမ်းသူသုံးလျှပ်စစ်ကားငယ်"
